asin,title,imgUrl,productURL,stars,reviews,price,listPrice,sub_category_id,isBestSeller,boughtInLastMonth
B005STKRLA,"Reed Tool PPR200 Clean Ream Extreme with 3/8-Inch Hex Shaft, 2-Inch Head, 2 x 2 x 3 inches",https://m.media-amazon.com/images/I/51qmPfqNYrL._AC_UL320_.jpg,https://www.amazon.com/dp/B005STKRLA,4.7,0,55.99,69.59,203,False,300
B0B4F5K7ZB,"50 Pieces XFITTING 1/2"" Pex Copper Ring, Pex B Crimp. (Black-Oxidized Surface)",https://m.media-amazon.com/images/I/611LUu+buNL._AC_UL320_.jpg,https://www.amazon.com/dp/B0B4F5K7ZB,4.8,0,10.09,10.99,203,False,300
B09L7X8Z7M,"Olive Puller Not Damage The Pipe Olive Remover Ferrule Puller Corrosion-Resistant Compression Ring Removal Tool Suitable for Brass Pipes with Diameters of NPT 1/2"" & NPT 3/4"" Ferrule Removal Tool",https://m.media-amazon.com/images/I/51Jl+aWcMpL._AC_UL320_.jpg,https://www.amazon.com/dp/B09L7X8Z7M,4.3,0,17.89,0.0,203,False,300
B08QD4F3W5,"3/4-Inch IPS Isolator Tankless Water Heater Service Valve Kit with Pressure Relief Valve, Clean Brass",https://m.media-amazon.com/images/I/71kMO5BnuLL._AC_UL320_.jpg,https://www.amazon.com/dp/B08QD4F3W5,4.6,0,44.79,59.99,203,False,200
B00HXHAHLA,"NDS 9P06 Downspout Adapter Centered PVC IPS, 3-Inch by 4-Inch by 4-Inch",https://m.media-amazon.com/images/I/51CR5OLQHiS._AC_UL320_.jpg,https://www.amazon.com/dp/B00HXHAHLA,4.5,0,4.98,0.0,203,False,300
B0BYVNFWWW,1540 Pcs 32 Size O-Rings Kit Nitrile Rubber Oring Assortment with 4 Hook Set for Various Car Auto Vehicle Repair Plumbing Pressure Washer Air or Gas Sealing Connections Resist Oil and Heat,https://m.media-amazon.com/images/I/81FoeRBpVvL._AC_UL320_.jpg,https://www.amazon.com/dp/B0BYVNFWWW,4.8,0,18.99,0.0,203,False,200
B0B46HVCDR,6 Inch Number Stencils Set 0-9 Address Number Stencil Templates Reusable Plastic Number Stencils for Cake Stencil Number Painting Stencils Templates,https://m.media-amazon.com/images/I/61o1NXroNbL._AC_UL320_.jpg,https://www.amazon.com/dp/B0B46HVCDR,4.4,0,10.99,0.0,204,True,100
B09JWF7C38,"2 Sheets 4.5 x 9 Feet Brick Stone Wall Backdrop Stone Wall Scene Setter Brick Sheet Wallpaper Curtains Door Removable Brick Tablecloth Photo for Winter/Halloween Christmas Party (Retro Red, Brick)",https://m.media-amazon.com/images/I/91b5--xGYXL._AC_UL320_.jpg,https://www.amazon.com/dp/B09JWF7C38,4.5,0,9.99,0.0,204,True,500
B089M9KVFS,"DIYASY Bats Wall Decor,120 Pcs 3D Bat Halloween Decoration Stickers for Home Decor 4 Size Waterproof Black Spooky Bats for Room Décor",https://m.media-amazon.com/images/I/712DvCKKmfL._AC_UL320_.jpg,https://www.amazon.com/dp/B089M9KVFS,4.5,0,7.95,13.99,204,False,30000
B0B1H2KZCC,"Halloween Decorations Bats Wall Decor Halloween Party Decorations Indoor Outdoor Halloween Decor Supplies, 64 Pcs Reusable PVC 3D Black Bats Stickers for Creepy Home Bathroom Decor",https://m.media-amazon.com/images/I/614iPDJ6r9L._AC_UL320_.jpg,https://www.amazon.com/dp/B0B1H2KZCC,4.6,0,6.99,9.99,204,False,10000
B0981HX8CN,【Upgraded Adhesives】Halloween Bats Wall Decor 3D Bats Decorations - 70 Pcs 5 Sizes Matte Black PVC Reusable DIY Bat Stickers Vintage Wall Decals for Home Decor Porch Door Indoor Outdoor Party Supplies,https://m.media-amazon.com/images/I/61hnqos+qSL._AC_UL320_.jpg,https://www.amazon.com/dp/B0981HX8CN,4.5,0,5.99,6.99,204,False,700
B09DQ7M77J,"Method Daily Wood Cleaner, Almond, Plant-Based Formula That Cleans Shelves, Tables and Other Wooden Surfaces While Removing Dust & Grime, 28 oz Spray Bottles, (Pack of 4)",https://m.media-amazon.com/images/I/713owRC8xHL._AC_UL320_.jpg,https://www.amazon.com/dp/B09DQ7M77J,4.7,0,20.96,27.96,204,False,1000
B001ESTA30,"Howard Products BBC0, Butcher Block Conditioner, 12 Fl Oz",https://m.media-amazon.com/images/I/51oQuFA73-L._AC_UL320_.jpg,https://www.amazon.com/dp/B001ESTA30,4.8,0,9.98,0.0,204,False,1000
B08LYSS7FH,"Bates- Paint Rollers, 4 inch Paint Roller with 10 Covers, Small Paint Roller, Paint Rollers for Painting Walls, Mini Rollers for Painting, Paint Roller Small, Paint Roller Frame, Wall Painting Tool",https://m.media-amazon.com/images/I/712FzVCO8xL._AC_UL320_.jpg,https://www.amazon.com/dp/B08LYSS7FH,4.4,0,8.95,0.0,204,False,1000
B078XJZGNN,Pro Grade - Chip Paint Brushes - 24 Ea 1 Inch Chip Paint Brush Light Brown,https://m.media-amazon.com/images/I/714mz5caK+L._AC_UL320_.jpg,https://www.amazon.com/dp/B078XJZGNN,4.5,0,11.99,0.0,204,False,700
B07BQHYLJJ,RetraGuard Safety Razor Blade Scraper Induction Hob Glass Cooktop Stovetop & Other Hard Surface Cleaning Scraper Includes 5 Replacement Scraper Blades,https://m.media-amazon.com/images/I/61RCWuOE18L._AC_UL320_.jpg,https://www.amazon.com/dp/B07BQHYLJJ,4.5,0,10.87,0.0,204,False,900
B01N9T9CZL,Solar Eclipse Glasses - CE and ISO Certified Safe Shades for Direct Sun Viewing - Made in the USA (10 Pack),https://m.media-amazon.com/images/I/719jOW3tvDL._AC_UL320_.jpg,https://www.amazon.com/dp/B01N9T9CZL,4.7,0,18.99,19.99,205,True,20000
B01BTUNHSQ,"Safety 1st Easy Install 28"" High Walk Thru Gate, Fits Between 29"" and 38""",https://m.media-amazon.com/images/I/81v4XhX2U-L._AC_UL320_.jpg,https://www.amazon.com/dp/B01BTUNHSQ,4.4,0,39.99,49.99,205,True,20000
B01NB09NHK,"5 Pack Eclipse Glasses, NASA Approved 2024, CE and ISO Certified, AAS Approved, Trusted for Solar Viewing",https://m.media-amazon.com/images/I/51BaEdv1PYL._AC_UL320_.jpg,https://www.amazon.com/dp/B01NB09NHK,4.6,0,12.99,0.0,205,False,10000
B0051U7W32,"Mack's Ultra Soft Foam Earplugs, 50 Pair - 33dB Highest NRR, Comfortable Ear Plugs for Sleeping, Snoring, Travel, Concerts, Studying, Loud Noise, Work | Made in USA",https://m.media-amazon.com/images/I/619ZmYATvfL._AC_UL320_.jpg,https://www.amazon.com/dp/B0051U7W32,4.5,0,14.99,0.0,205,False,20000
B09GLY1S79,Funight KN95 Face Masks 50 Pack 5-Ply Breathable Filter Disposable Face Masks Black,https://m.media-amazon.com/images/I/81G2eEyf1kL._AC_UL320_.jpg,https://www.amazon.com/dp/B09GLY1S79,4.6,0,19.99,29.99,205,False,10000
B072WHQFJ7,"GearLight 2pack S1000 LED Flashlights High Lumens - Mini Flashlights for Camping, Hiking, Walking - Powerful Emergency Flashlights with 5 Modes for Outdoor Use - Bright Flashlight with Zoomable Beam",https://m.media-amazon.com/images/I/81FQCYRrv6L._AC_UL320_.jpg,https://www.amazon.com/dp/B072WHQFJ7,4.6,0,19.99,29.94,205,False,10000
B075XQ2XYV,"Evenflo Position & Lock Baby Gate, Pressure-Mounted, Farmhouse Collection",https://m.media-amazon.com/images/I/91wo2J1OetL._AC_UL320_.jpg,https://www.amazon.com/dp/B075XQ2XYV,3.8,0,19.98,21.99,205,False,10000
B001OC5UMQ,"Regalo Easy Step 38.5-Inch Wide Walk Thru Baby Gate, Includes 6-Inch Extension Kit, Pressure Mount Kit, Wall Cups and Mounting Kit",https://m.media-amazon.com/images/I/61vUvtejXrL._AC_UL320_.jpg,https://www.amazon.com/dp/B001OC5UMQ,4.5,0,36.99,44.99,205,False,10000
B07FMF5SPC,"Rain Ponchos,with Drawstring Hood （10 Pack） Emergency Disposable Rain Ponchos Family Pack for Adults,Clear",https://m.media-amazon.com/images/I/615nfSIS8WL._AC_UL320_.jpg,https://www.amazon.com/dp/B07FMF5SPC,4.5,0,14.85,20.95,205,False,6000
B0B4KK73NB,"Headlamp Rechargeable 2PCS, 230° Wide Beam Head Lamp LED with Motion Sensor for Adults - Camping Accessories Gear, Waterproof Head Light Flashlight for Hiking, Running, Repairing, Fishing, Cycling",https://m.media-amazon.com/images/I/61uzEOHmH1L._AC_UL320_.jpg,https://www.amazon.com/dp/B0B4KK73NB,4.6,0,24.99,33.99,205,False,5000
B07TSN384X,"OuuKoo Salt Lamp Bulbs - 15 Watt Light Bulbs for Scentsy Wax Warmer - C7 Replacement Bulbs for Plug in Wax Diffuser- Warmwhite - Dimmable,15 Packs",https://m.media-amazon.com/images/I/71FNBqQTvqL._AC_UL320_.jpg,https://www.amazon.com/dp/B07TSN384X,4.6,15776,6.88,0.0,206,True,0
B0B55NT6W5,"Wiyifada LED Black Light Bulbs 2 Pack, Dimmable A19 10W Blacklight bulb Replace Up to 100W, 110V E26 Base Black Light UVA Level 385-400nm, Glow in the Dark for Body Paint, Blacklights Party, Halloween",https://m.media-amazon.com/images/I/71oWecqoSHL._AC_UL320_.jpg,https://www.amazon.com/dp/B0B55NT6W5,4.5,2028,9.99,0.0,206,True,0
B08FRSS4BF,"SYLVANIA ECO LED Light Bulb, A19 60W Equivalent, Efficient 9W, 7 Year, 750 Lumens, 2700K, Non-Dimmable, Frosted, Soft White - 8 Pack (40821)",https://m.media-amazon.com/images/I/81wKhRO66oL._AC_UL320_.jpg,https://www.amazon.com/dp/B08FRSS4BF,4.7,40930,13.17,13.99,206,False,0
B08W4ZYD8T,"ALAMPEVER Dimmable 12-Pack CA11 Candelabra LED Light Bulb, 4.5W (60W Equivlant) LED Chandelier Light Bulb, E26 Medium Base, 2700K Soft White, 450LM, CRI80",https://m.media-amazon.com/images/I/71b5KCGg3vL._AC_UL320_.jpg,https://www.amazon.com/dp/B08W4ZYD8T,4.6,373,16.05,21.99,206,False,0
B093RVLGSM,"MAXvolador Dimmable Vintage LED Light Bulb 60W Equivalent, 6W 800Lumens 5000K Daylight White, ST58 Antique Filament Edison Bulb CRI 85+, E26 Medium Base, Clear Glass, Pack of 12",https://m.media-amazon.com/images/I/71oXj3lty5L._AC_UL320_.jpg,https://www.amazon.com/dp/B093RVLGSM,4.7,1212,29.99,0.0,206,False,0
B077P5BTCY,"CPPSLEE LED Flame Light Bulbs, 4 Modes Fire Light Bulbs, E26 Base Flame Bulb, Halloween Decorations Outdoor Indoor Home, Halloween Lights Bulbs (Yellow, 2 Pack)",https://m.media-amazon.com/images/I/7180ZbrXTSL._AC_UL320_.jpg,https://www.amazon.com/dp/B077P5BTCY,4.3,17507,14.99,19.99,206,False,0
B08YJQ8V1X,"Hompavo 【Upgraded】 LED Flame Light Bulbs Halloween Decorations, 4 Modes Flickering Light Bulbs with Upside Down Effect, E26/E27 Base Flame Bulb for Christmas Party Home Indoor & Outdoor (2 Pack)",https://m.media-amazon.com/images/I/71K3vpaS2SS._AC_UL320_.jpg,https://www.amazon.com/dp/B08YJQ8V1X,4.5,5220,14.79,0.0,206,False,0
B09B7NQT2K,"Govee Smart Light Bulbs, WiFi Bluetooth Color Changing Light Bulbs, Music Sync, 54 Dynamic Scenes, 16 Million DIY Color RGB Light Bulbs, Work with Alexa, Google Assistant & Govee Home App, 4 Pack",https://m.media-amazon.com/images/I/61VxkyychvL._AC_UL320_.jpg,https://www.amazon.com/dp/B09B7NQT2K,4.7,6306,39.99,0.0,206,False,0
B00J7Q957C,"SYLVANIA LED Light Bulb, 60W Equivalent A19, Efficient 8.5W, Medium Base, Frosted Finish, 800 Lumens, Bright White - 4 Pack (79704)",https://m.media-amazon.com/images/I/71ECxPrS6YS._AC_UL320_.jpg,https://www.amazon.com/dp/B00J7Q957C,4.7,32094,5.79,0.0,206,False,0
B091HH9K97,"MAXvolador A19 LED Light Bulbs, 100 Watt Equivalent Daylight 5000K, 1500 Lumens, E26 Standard Base, Non-Dimmable, 13W Bright White Bulbs for Bedroom Living Room Home Office, 4-Pack",https://m.media-amazon.com/images/I/61odv81lQ+L._AC_UL320_.jpg,https://www.amazon.com/dp/B091HH9K97,4.7,5506,9.99,0.0,206,False,0
B005IW2OUY,"DEWALT Portable Band Saw Blade, 32-7/8-Inch, .020-Inch, 24 TPI, 3-Pack (DW3984C)",https://m.media-amazon.com/images/I/71KU62lxNtL._AC_UL320_.jpg,https://www.amazon.com/dp/B005IW2OUY,4.6,0,20.99,0.0,207,True,1000
B0796QZWFM,"Giraffe Tools TA15B Retractable Air Hose Reel Wall Mount 3/8"" x 50 ft Hybrid Hose, Air Compressor Heavy Duty Steel Reel Auto Rewind 300PSI, 50ft, Tangelo",https://m.media-amazon.com/images/I/61XCqWBxdEL._AC_UL320_.jpg,https://www.amazon.com/dp/B0796QZWFM,4.4,0,99.99,0.0,207,True,700
B097SXK3FG,"WORKPRO Premium Utility Knife, 1PC Retractable All Metal Heavy Duty Box Cutter, Quick Change Blade Razor Knife, with 10 Extra Blades",https://m.media-amazon.com/images/I/71vDElw8ywL._AC_UL320_.jpg,https://www.amazon.com/dp/B097SXK3FG,4.8,0,8.99,11.99,207,False,4000
B08D9QHD2N,"Amazon Basics Plastic Putty Knives 3-Pack: 1-1/2"", 3"", 6""",https://m.media-amazon.com/images/I/61csWsrDJHL._AC_UL320_.jpg,https://www.amazon.com/dp/B08D9QHD2N,4.6,0,4.53,5.4,207,False,2000
B09955YQJQ,"Putty Knife, 4Pcs Spackle Knife Set (2, 3, 4, 5 in), Stainless Steel Paint Scraper, Taping Knife Tool for Repairing Drywall, Removing Wallpaper, Applying Putty, Plaster, Cement, Adhesive",https://m.media-amazon.com/images/I/61qBVm7Rf1L._AC_UL320_.jpg,https://www.amazon.com/dp/B09955YQJQ,4.6,0,7.99,9.45,207,False,2000
B0723914V1,DEKOPRO 228 Piece Socket Wrench Auto Repair Tool Combination Package Mixed Tool Set Hand Tool Kit with Plastic Toolbox Storage Case,https://m.media-amazon.com/images/I/71PexuvCDNL._AC_UL320_.jpg,https://www.amazon.com/dp/B0723914V1,4.6,0,79.99,99.99,207,False,2000
B003XXUYZ2,"DEWALT Screwdriver Bit Set, Rapid Load, Tin, 20-Piece (DW2503)",https://m.media-amazon.com/images/I/81RGL+Clb1L._AC_UL320_.jpg,https://www.amazon.com/dp/B003XXUYZ2,4.8,0,14.99,26.73,207,False,1000
B079MJ6MLV,"LEATHERMAN, Wave Plus Multitool with Premium Replaceable Wire Cutters, Spring-Action Scissors and Molle Black Sheath, Black",https://m.media-amazon.com/images/I/71xUl-9KRhL._AC_UL320_.jpg,https://www.amazon.com/dp/B079MJ6MLV,4.8,0,119.95,0.0,207,False,2000
B0086AJFAM,"Milwaukee Genuine OEM 48-59-2401 M12 Lithium Ion 12 Volt Battery Charger w/LED Indicating, Red",https://m.media-amazon.com/images/I/81E96hpq+YL._AC_UL320_.jpg,https://www.amazon.com/dp/B0086AJFAM,4.7,0,17.5,49.99,207,False,1000
B00023RYS6,"FELCO F-2 068780 Classic Manual Hand Pruner, F 2",https://m.media-amazon.com/images/I/51TsuqoH63L._AC_UL320_.jpg,https://www.amazon.com/dp/B00023RYS6,4.8,0,58.99,73.99,207,False,1000
B00004SU18,"Brita Standard Water Filter Replacements for Pitchers and Dispensers, Lasts 2 Months, Reduces Chlorine Taste and Odor, 3 Count",https://m.media-amazon.com/images/I/719bI3NO9aL._AC_UL320_.jpg,https://www.amazon.com/dp/B00004SU18,4.8,0,17.56,0.0,208,True,30000
B07PBV7D48,"Hair Catcher Durable Silicone Hair Stopper Shower Drain Covers Easy to Install and Clean Suit for Bathroom Bathtub and Kitchen, Pack of 5",https://m.media-amazon.com/images/I/715ocQz+SPL._AC_UL320_.jpg,https://www.amazon.com/dp/B07PBV7D48,3.9,0,7.99,14.99,208,True,20000
B01MUBU0YC,"AquaBliss High Output Revitalizing Shower Filter - Reduces Dry Itchy Skin, Dandruff, Eczema, and Dramatically Improves The Condition of Your Skin, Hair and Nails - Chrome (SF100)",https://m.media-amazon.com/images/I/61wN3sOvcoL._AC_UL320_.jpg,https://www.amazon.com/dp/B01MUBU0YC,4.4,0,35.86,0.0,208,False,30000
B075L81JP5,"AquaBliss Replacement Cartridge SFC100 High Output Multi Stage Revitalizing Shower Filter – Reduces Chemicals & Chlorine - Restores PH Balance, Glowing Skin, Strong Nails & Shimmering Hair",https://m.media-amazon.com/images/I/61UTYJz3z-L._AC_UL320_.jpg,https://www.amazon.com/dp/B075L81JP5,4.7,0,15.99,24.99,208,False,10000
B07PB6ZX9Y,"TubShroom Ultra Revolutionary Bath Tub Drain Protector Hair Catcher/Strainer/Snare Stainless Steel, 1-Pack, Silver",https://m.media-amazon.com/images/I/81s5ng0S12L._AC_UL320_.jpg,https://www.amazon.com/dp/B07PB6ZX9Y,4.7,0,11.76,15.99,208,False,10000
B00OCEBMFM,"OXO Good Grips Silicone Shower & Tub Drain Protector, Gray",https://m.media-amazon.com/images/I/712Sg5SB59L._AC_UL320_.jpg,https://www.amazon.com/dp/B00OCEBMFM,4.3,0,11.99,0.0,208,False,10000
B01M0H7YC2,"TubShroom Tub Hair Catcher Protector, Fits 1.5"" - 1.75"" Drain, Gray",https://m.media-amazon.com/images/I/81N-k0wkz7L._AC_UL320_.jpg,https://www.amazon.com/dp/B01M0H7YC2,4.5,0,11.99,19.95,208,False,7000
B07W8218FZ,"SinkShroom Ultra Revolutionary Bathroom Sink Drain Protector, Stainless Steel",https://m.media-amazon.com/images/I/81wT6uTE9FL._AC_UL320_.jpg,https://www.amazon.com/dp/B07W8218FZ,4.7,0,12.97,19.99,208,False,7000
B07HD7JVLB,"Squatty Potty The Original Toilet Stool - Bamboo Flip, 7"" and 9"" Adjustable Heights, Brown - Improve Bathroom Posture and Comfort",https://m.media-amazon.com/images/I/718+8-YUNSL._AC_UL320_.jpg,https://www.amazon.com/dp/B07HD7JVLB,4.7,0,0.0,0.0,208,False,10000
B0B158ZL99,"3 and 5 Gallon Water Jug Cap, Silicone Reusable Replacement Cap, Non Spill Bottle Caps for 55mm Bottle Water Dispenser Caps - Pack of 3",https://m.media-amazon.com/images/I/61w8zILfAwL._AC_UL320_.jpg,https://www.amazon.com/dp/B0B158ZL99,4.6,0,9.98,0.0,208,True,6000
B08L7DD8L9,"LED Floor Lamp, Bright 15W Floor Lamps for Living Room with 1H Timer, Stepless Adjustable 3000K-6000K Colors & Brightness Standing Lamp with Remote & Touch Control Reading Floor Lamps",https://m.media-amazon.com/images/I/61jVnjd9EIL._AC_UL320_.jpg,https://www.amazon.com/dp/B08L7DD8L9,4.6,0,31.97,39.99,209,True,6000
B09M8NVC12,"Custom Neon Signs,Personalized Dimmable LED Neon Signs for Family Birthday Bar Wedding Party Night Light&Company Logo or Business Signs, Birthday Gift Giving Name Neon Lights(Optional 18"" to 60"")",https://m.media-amazon.com/images/I/714uHxYXN0L._AC_UL320_.jpg,https://www.amazon.com/dp/B09M8NVC12,4.8,0,49.98,0.0,209,True,4000
B07Q4487Y8,"Remote Control Tealights with Timer,Battery Operated Flameless Candle with Flickering Amber Bulb,Electric Tea Light in Wave Open, Best for Holiday Decoration,Wedding,Pack of 12",https://m.media-amazon.com/images/I/617EC5l4f3L._AC_UL320_.jpg,https://www.amazon.com/dp/B07Q4487Y8,4.4,0,15.95,0.0,209,False,1000
B07NKRPZXN,"Desk Lamp Clip on Light, 48 LEDs USB Clip Ring Light with 3 Color Modes 10 Dimmable Brightness, Eye Protection Desk Light, 360° Flexible Gooseneck for Desk Headboard Reading",https://m.media-amazon.com/images/I/61Lm0-OsPNS._AC_UL320_.jpg,https://www.amazon.com/dp/B07NKRPZXN,4.5,0,11.99,0.0,209,False,1000
B0B5B517H7,"Eye Candy Ultra Bright Full Page Magnifier and Book Light, As Seen On TV Anti Glare Reading Light Makes Pages 3X Bigger with Dimmable Brightness",https://m.media-amazon.com/images/I/81CxRdlcgTL._AC_UL320_.jpg,https://www.amazon.com/dp/B0B5B517H7,4.0,0,14.98,0.0,209,False,2000
B095HG3QJY,"Keepsmile 50ft Led Lights for Bedroom, Bluetooth Smart APP Control RGB Color Changing Led Strip Lights with Remote Control and Power Adapter Led Lights for Room Kitchen Party Home Decoration",https://m.media-amazon.com/images/I/71Qost9vtQS._AC_UL320_.jpg,https://www.amazon.com/dp/B095HG3QJY,4.5,0,12.99,19.99,209,False,2000
B0C2MHG632,"Led Lights for Bedroom 100 ft (2 Rolls of 50ft) Music Sync Color Changing RGB Led Strip Lights with Remote App Control Bluetooth Led Strip, Led Lights for Room Home Kitchen Decor Party",https://m.media-amazon.com/images/I/81T-QM6v5OL._AC_UL320_.jpg,https://www.amazon.com/dp/B0C2MHG632,4.5,0,13.99,0.0,209,False,3000
B0C6QJHDPG,"Halloween Pumpkin String Lights with Witch Hat, 20 LED 16.4FT 8 Modes Timer 3D Waterproof Orange Jack-O-Lantern Battery Operated Flickering Lights for Indoor Outdoor Decor Party Decorations",https://m.media-amazon.com/images/I/71bJEpkzcTL._AC_UL320_.jpg,https://www.amazon.com/dp/B0C6QJHDPG,0.0,0,14.99,0.0,209,False,300
B07J5VL8CG,"Flameless LED Candles with 10-Key Remote & Timer, Outdoor Indoor Waterproof Battery Operated Candles for Home/Wedding Décor, Exquisite Set of 12 (D2.2'' x H4''5''6''7'')",https://m.media-amazon.com/images/I/61EUuk21nBL._AC_UL320_.jpg,https://www.amazon.com/dp/B07J5VL8CG,4.5,0,26.39,35.99,209,False,4000
B09QHYWS6X,"Brizled Orange & Purple Halloween Lights, 39.37ft 120 LED Orange Lights, Purple Solar Halloween Lights 8 Modes, Outdoor Twinkle Orange Halloween String Lights for Halloween Party DIY Decor, Black Wire",https://m.media-amazon.com/images/I/81nvxe7IXeL._AC_UL320_.jpg,https://www.amazon.com/dp/B09QHYWS6X,4.3,0,18.99,23.99,209,False,4000
B081TVR4N7,"Klein Tools 56331 Electrical Fish Tape, Steel Wire Puller with Double Loop Tip, Optimized Housing and Handle, 1/8-Inch x 50-Foot",https://m.media-amazon.com/images/I/71Wab7hH7jS._AC_UL320_.jpg,https://www.amazon.com/dp/B081TVR4N7,4.6,0,24.99,31.64,210,True,1000
B08CJGPHL9,Smart Home Energy Monitor with 16 50A Circuit Level Sensors | Vue - Real Time Electricity Monitor/Meter | Solar/Net Metering,https://m.media-amazon.com/images/I/61-yO4nnK4L._AC_UL320_.jpg,https://www.amazon.com/dp/B08CJGPHL9,4.5,0,164.99,0.0,210,True,1000
B07HCQKRRY,"Fosmon 24 Hour Programmable Digital Timer Outlet (2 Pack), ON/Off Program, LCD Display, Mini Indoor Single Plug-in Outlet Timer, 125V 15A for Seasonal Light, Lamp, Heater, Portable Fan, Aquarium",https://m.media-amazon.com/images/I/61Gns2QLUGL._AC_UL320_.jpg,https://www.amazon.com/dp/B07HCQKRRY,4.5,0,11.99,0.0,210,False,3000
B08CX9W7G3,"KAIWEETS Digital Multimeter with Case, DC AC Voltmeter, Ohm Volt Amp Test Meter and Continuity Test Diode Voltage Tester for Household Outlet, Automotive Battery Test (Anti-Burn with Double Fuses)",https://m.media-amazon.com/images/I/81PMe+1PBbL._AC_UL320_.jpg,https://www.amazon.com/dp/B08CX9W7G3,4.5,0,15.99,17.49,210,False,3000
B0915X9MTD,"12 Pack Cable Clips, Znben Cord Organizer Holder Adhesive Cord Management Charger Wire Holder Clips for Desk, Home, Office, Car, Cubicle, Nightstand - Black",https://m.media-amazon.com/images/I/61SCIVUKc-L._AC_UL320_.jpg,https://www.amazon.com/dp/B0915X9MTD,4.3,0,6.99,9.99,210,False,3000
B099SJ6469,"Klein Tools NCVT1P Voltage Tester, Non-Contact Voltage Detector Pen, 50V to 1000V AC, Audible and Flashing LED Alarms, Pocket Clip,Green/Red/Yellow",https://m.media-amazon.com/images/I/412nrsDmOxL._AC_UL320_.jpg,https://www.amazon.com/dp/B099SJ6469,4.6,0,17.07,0.0,210,False,4000
B0BLXQWLTV,"WAGO 221 Series 80pc Compact Splicing Wire Connectors Assortment Pack | 221 Series Assortment with Case | Includes (40x 221-412), (25x 221-413), (15x 221-415)",https://m.media-amazon.com/images/I/81HA6buHEfL._AC_UL320_.jpg,https://www.amazon.com/dp/B0BLXQWLTV,4.7,0,19.99,0.0,210,False,400
B09224B5ZZ,"Non-Contact Voltage Tester Tools,LED Flashlight,Buzzer Alarm,AC Voltage Detector Pen,Test Range 60V - 1000V for Live/Null Wire Judgment…",https://m.media-amazon.com/images/I/51nT98R+KqS._AC_UL320_.jpg,https://www.amazon.com/dp/B09224B5ZZ,4.4,0,8.99,0.0,210,False,400
B072174XRB,eBoot 2 Groups 1M Test Leads Set with Alligator Clips Double-ended Jumper Wires (2 Groups),https://m.media-amazon.com/images/I/71VI7ydxKRL._AC_UL320_.jpg,https://www.amazon.com/dp/B072174XRB,4.4,0,5.45,0.0,210,False,400
B07H9MCTGL,"Miady Short Power Extension Cord Outlet Saver, 16AWG/13A, 3 Prong (10 Pack, Black, 8 Inch)",https://m.media-amazon.com/images/I/61bH4dGoRVL._AC_UL320_.jpg,https://www.amazon.com/dp/B07H9MCTGL,4.8,0,19.99,0.0,210,False,1000
B0BJ6CT8GP,"Kitsure Toilet Paper Holder Stand - Free-Standing with a Weighted Base, Durable & Rustless Shelf and Storage Design, Black",https://m.media-amazon.com/images/I/51HGAJxqyDL._AC_UL320_.jpg,https://www.amazon.com/dp/B0BJ6CT8GP,4.7,514,15.99,19.99,211,True,1000
B071X9MFYL,"SMARTSTANDARD 16"" Hairpin Furniture Legs, Metal Home DIY Projects for Nightstand, Coffee Table, Desk, etc with Rubber Floor Protectors Black 4PCS",https://m.media-amazon.com/images/I/71LkCD7egrL._AC_UL320_.jpg,https://www.amazon.com/dp/B071X9MFYL,4.8,14813,21.99,39.99,211,True,1000
B07439JX2T,"CO-Z Furniture Sliders, 8 Pack Plastic Sliders for Furniture Legs, 3.5 Inch Furniture Carpet Moving Pads, Chair Leg Floor Protectors Movers Coasters for Hardwood Floor, Reusable Round Glides Glider",https://m.media-amazon.com/images/I/71dhcuP2svL._AC_UL320_.jpg,https://www.amazon.com/dp/B07439JX2T,4.6,12235,8.99,0.0,211,False,2000
B00JU3JMHK,"RovingCove Corner Protector for Baby (4 Large Corners) - Hefty-Fit Heavy-Duty Soft Rubber Foam Furniture Corner Bumper Guards, 3M Adhesive Pre-Taped, Onyx Black",https://m.media-amazon.com/images/I/41WU4qhx06L._AC_UL320_.jpg,https://www.amazon.com/dp/B00JU3JMHK,4.6,9327,7.99,9.99,211,False,2000
B0BP14N9M5,"984 Ft Twine String, Natural Jute Twine, 2mm Thin White Cotton Twine Rope, 10ply Black Cotton Twine for Crafts, Art, Gardening Plants, Gift Wrapping, Decoration, Packing String Bulk(3 Rolls)",https://m.media-amazon.com/images/I/81U1ggNayoL._AC_UL320_.jpg,https://www.amazon.com/dp/B0BP14N9M5,4.7,227,5.99,0.0,211,False,2000
B001XUMBIA,"GEAR AID Aquaseal FD Flexible Repair Adhesive for Outdoor Gear and Vinyl, Clear Glue",https://m.media-amazon.com/images/I/81iQ08CTJLL._AC_UL320_.jpg,https://www.amazon.com/dp/B001XUMBIA,4.6,4684,8.99,0.0,211,False,2000
B092843CHY,"MAXvolador Solar Powered Address Sign House Numbers Waterproof, 3-Color Lighting Modes LED Illuminated Address Wall Plaque with Stakes, Outdoor Wall Mounted & In Ground Address Number for Home Yard",https://m.media-amazon.com/images/I/7150eO9vSzL._AC_UL320_.jpg,https://www.amazon.com/dp/B092843CHY,4.5,1111,25.99,0.0,211,False,2000
B001KVMNPI,"Monkey Hooks Picture Hangers Home and Office Pack, Gorilla Hook, Drywall Hooks for Hanging Pictures, Wall Hooks, Picture Hangers, Picture Hanging Kit, 30 pc set",https://m.media-amazon.com/images/I/71XjMB1aIKL._AC_UL320_.jpg,https://www.amazon.com/dp/B001KVMNPI,4.7,10032,14.0,19.75,211,False,3000
B09DCV8R63,"BUMACO 40Pcs Chair Leg Floor Protectors Silicone Covers to Protect Floors, Circular,Round,Square (Large Clear Fit 1.3""-2"")",https://m.media-amazon.com/images/I/71b9frSkH0L._AC_UL320_.jpg,https://www.amazon.com/dp/B09DCV8R63,4.3,8276,18.98,23.98,211,False,3000
B00ODV8FKY,"RovingCove Edge Corner Protector Baby Proofing (Large 18ft 8 Corners), Hefty-Fit Heavy-Duty, Soft NBR Rubber Foam, Furniture Fireplace Safety Bumper Guard, 3M Adhesive, Coffee Brown",https://m.media-amazon.com/images/I/51Y2X9mw4oL._AC_UL320_.jpg,https://www.amazon.com/dp/B00ODV8FKY,4.5,31991,21.4,22.99,211,False,3000
B0BSNJ4L73,"AUGO Magnetic Screen Door - Self Sealing, Heavy Duty, Hands Free Mesh Partition Keeps Bugs Out - Pet and Kid Friendly - Patent Pending Keep Open Feature - 36 Inch x 97 Inch",https://m.media-amazon.com/images/I/71lpWm7IGwL._AC_UL320_.jpg,https://www.amazon.com/dp/B0BSNJ4L73,4.5,0,27.99,0.0,212,True,1000
B00VFACQRE,"Wonder Wheel 4"" Decal Remover Eraser Wheel Toolkit, Remove Car Decals, Vinyl & Stickers in Minutes, Adhesive Remover Rubber Wheel, Emblem Removal Tool, Sticker Remover for Cars, Drill Adapter Supplied",https://m.media-amazon.com/images/I/71hZ-zrxrqL._AC_UL320_.jpg,https://www.amazon.com/dp/B00VFACQRE,4.4,0,14.49,24.97,212,True,1000
B00CJZ7VJC,"Filterbuy 14x30x1 Air Filter MERV 8 Dust Defense (4-Pack), Pleated HVAC AC Furnace Air Filters Replacement (Actual Size: 13.69 x 29.69 x 0.75 Inches)",https://m.media-amazon.com/images/I/81lce5iaOIL._AC_UL320_.jpg,https://www.amazon.com/dp/B00CJZ7VJC,4.7,0,38.12,0.0,212,False,3000
