asin,title,imgUrl,productURL,stars,reviews,price,listPrice,sub_category_id,isBestSeller,boughtInLastMonth
B0CGDCP2QM,"jumper Laptop, 16GB RAM 512GB SSD, 12th Gen Intel N100 Processor, 16"" FHD IPS Screen(16:10), Notebook Computer with 2.4G/5G WiFi, 4 Stereo Speakers, Cooling System, 38WH Battery, Type-C.",https://m.media-amazon.com/images/I/71wuZUWHNGL._AC_UL320_.jpg,https://www.amazon.com/dp/B0CGDCP2QM,4.6,0,379.99,0.0,57,False,0
B09NRXLCGJ,"Late 2021 Apple MacBook Pro with Apple M1 Pro chip (16 inch, 16GB RAM, 1TB SSD) (QWERTY English) Space Gray (Renewed)",https://m.media-amazon.com/images/I/61SP1frHPxL._AC_UL320_.jpg,https://www.amazon.com/dp/B09NRXLCGJ,4.6,0,1529.89,0.0,57,False,0
B0C3RR2Z8W,"HP 17 Laptop, 17.3” HD+ Display, 11th Gen Intel Core i3-1125G4 Processor, 16GB RAM, 1TB SSD, Wi-Fi, HDMI, Webcam, Windows 11 Home, Silver",https://m.media-amazon.com/images/I/71CDSpds6jL._AC_UL320_.jpg,https://www.amazon.com/dp/B0C3RR2Z8W,4.5,0,506.0,599.99,57,False,0
B0BWSG8VDK,"Lenovo IdeaPad Flex 5-2023 - Touchscreen 2-in-1 Laptop - Windows 11 Home - 14"" FHD Display - 16GB Memory - 256GB Storage - AMD Ryzen 5 5500U - Abyss Blue",https://m.media-amazon.com/images/I/718cys6JGoL._AC_UL320_.jpg,https://www.amazon.com/dp/B0BWSG8VDK,4.2,0,539.99,0.0,57,False,0
B09XKTK4RB,Gateway Newest Touchscreen 11.6 HD 2-in-1 Convertible Laptop in Blue Intel N4020 4GB RAM 64GB SSD Mini-HDMI Webcam Windows 10 S (Renewed) (GT-116),https://m.media-amazon.com/images/I/51LQKOGBqdL._AC_UL320_.jpg,https://www.amazon.com/dp/B09XKTK4RB,3.9,0,129.99,140.29,57,False,0
B0CGLLL9D9,"2 Pack-Apple Earbuds/iPhone Headphones/Wired Earphones/Lightning Headsets[Apple MFi Certified] Built-in Microphone & Volume Control Compatible with iPhone 14/13/12/11/SE/X/XR/XS/8/7, Support All iOS",https://m.media-amazon.com/images/I/51qiRMP2mrL._AC_UL320_.jpg,https://www.amazon.com/dp/B0CGLLL9D9,4.4,0,9.99,13.99,58,True,0
B09Q347XBZ,Tab A7 10.4 T500 USB Charging Port Flex Cable Replacement T505 USB Type-C Charger Dock Board Flex Connector for Samsung Galaxy Tab A7 10.4 Port SM-T500 SM-T505 SM-T505N Port Flex Cable Repair Part,https://m.media-amazon.com/images/I/61okSPpc3uL._AC_UL320_.jpg,https://www.amazon.com/dp/B09Q347XBZ,4.4,0,8.99,0.0,58,True,0
B0B2PTMF7Z,Ygpmoiki for Samsung Galaxy Tab A8 10.5 2021 SM-X200 SM-X205 X200 LCD Display Touch Digitizer Replacment,https://m.media-amazon.com/images/I/410iDZob0ML._AC_UL320_.jpg,https://www.amazon.com/dp/B0B2PTMF7Z,5.0,1,58.99,0.0,58,False,0
B0C6XLTVHM,Touch Screen for Onn 10.1 inch Tablet 100005208 Digitizer for ONN ONA19TB003 100005208 10.1 inch Touchscreen Replacement Front Glass Panel with Repair Tools,https://m.media-amazon.com/images/I/61KPDf4AmLL._AC_UL320_.jpg,https://www.amazon.com/dp/B0C6XLTVHM,0.0,0,13.3,0.0,58,False,0
B0BYZM97JL,"9.7"" LCD Screen Replacement for iPad 5 (5th Gen) 2017 A1822 A1823 A1474 A1475 A1476 Display LCD Touch Screen Replacement Premium Repair Kit Black",https://m.media-amazon.com/images/I/61dmOWdF25L._AC_UL320_.jpg,https://www.amazon.com/dp/B0BYZM97JL,0.0,0,89.9,0.0,58,False,0
B0986N3RMD,New for 10.1'' inch Teclast P20HD Tablet External capacitive Touch Screen Digitizer Panel Sensor replacem,https://m.media-amazon.com/images/I/61blQybFFqL._AC_UL320_.jpg,https://www.amazon.com/dp/B0986N3RMD,5.0,1,16.5,0.0,58,False,0
B096TMHLFY,SwarKing Replacement Battery Compatible with L18D1P32 Lenovo TAB M10 TB-X505X with Toolkit,https://m.media-amazon.com/images/I/61AKvBdtoMS._AC_UL320_.jpg,https://www.amazon.com/dp/B096TMHLFY,0.0,0,15.0,0.0,58,False,0
B07FQS9LXZ,Harry Potter (Magic Portrait) 11Oz/315Ml Heat Changing Mug,https://m.media-amazon.com/images/I/71kKYi5nZAL._AC_UL320_.jpg,https://www.amazon.com/dp/B07FQS9LXZ,3.2,14,0.0,0.0,58,False,0
B01BSK2F5S,PureGear DualTek PRO for Samsung Galaxy S7 edge - Black/Clear,https://m.media-amazon.com/images/I/31ZgNcMYadL._AC_UL320_.jpg,https://www.amazon.com/dp/B01BSK2F5S,3.0,7,9.95,0.0,58,False,0
B0BQWZXC5W,GM Genuine Parts 25779972 Mobile Telephone Antenna Cable,https://m.media-amazon.com/images/I/71luRbfiRIL._AC_UL320_.jpg,https://www.amazon.com/dp/B0BQWZXC5W,0.0,0,58.79,0.0,58,False,0
B0BDSM76W4,WiFi Extender Signal Booster | 2023 Release Up to 74% Faster | Broader Coverage Than Ever | WiFi Extenders Signal Booster for Home w/Ethernet Port | Internet Booster and WiFi Repeater | Made for USA,https://m.media-amazon.com/images/I/51kHOZQpA5L._AC_UL320_.jpg,https://www.amazon.com/dp/B0BDSM76W4,4.4,0,36.99,0.0,60,True,0
B00A128S24,"TP-Link TL-SG105, 5 Port Gigabit Unmanaged Ethernet Switch, Network Hub, Ethernet Splitter, Plug & Play, Fanless Metal Design, Shielded Ports, Traffic Optimization,Navy Blue",https://m.media-amazon.com/images/I/71kcM4nLRjL._AC_UL320_.jpg,https://www.amazon.com/dp/B00A128S24,4.7,0,17.99,19.99,60,True,0
B09PRB1MZM,"TP-Link Deco AX3000 WiFi 6 Mesh System(Deco X55) - Covers up to 6500 Sq.Ft. , Replaces Wireless Router and Extender, 3 Gigabit ports per unit, supports Ethernet Backhaul (3-pack)",https://m.media-amazon.com/images/I/61D7vtclcsL._AC_UL320_.jpg,https://www.amazon.com/dp/B09PRB1MZM,4.5,0,199.99,229.99,60,False,0
B0BP1RS196,WiFi Extender Signal Booster for Home - 2023 Release Up to 9956 sq.ft Coverage - Long Range Wireless Internet Repeater and Signal Amplifier with Ethernet Port - 1 Tap Setup,https://m.media-amazon.com/images/I/712wURwnWVL._AC_UL320_.jpg,https://www.amazon.com/dp/B0BP1RS196,4.8,0,59.95,69.0,60,False,0
B09N72FMH5,GL.iNet GL-SFT1200 (Opal) Secure Travel WiFi Router – AC1200 Dual Band Gigabit Ethernet Wireless Internet Router | IPv6 | USB 2.0 | MU-MIMO | DDR3 |128MB Ram | Repeater Bridge | Access Point Mode,https://m.media-amazon.com/images/I/41yDlYxsHAL._AC_UL320_.jpg,https://www.amazon.com/dp/B09N72FMH5,4.4,0,39.9,49.9,60,False,0
B0BCQSYPZB,Google Nest WiFi Pro - 6E - Reliable Home Wi-Fi System with Fast Speed and Whole Home Coverage - Mesh Router - 3 Pack - Snow,https://m.media-amazon.com/images/I/51onk4ciRbL._AC_UL320_.jpg,https://www.amazon.com/dp/B0BCQSYPZB,4.0,0,387.0,0.0,60,False,0
B0CBTXF5XF,"2023 Release WiFi 6 Extenders Signal Booster for Home, 2.4Gb/s Speed Longest Range Up to 12,000sq.ft, Internet Amplifier with Ethernet Port, Dual Band Wi-Fi Repeater 1-Tap Setup (5GHz / 2.4GHz)",https://m.media-amazon.com/images/I/51zFF3z-rDL._AC_UL320_.jpg,https://www.amazon.com/dp/B0CBTXF5XF,4.7,0,99.8,0.0,60,False,0
B0C8JQHNJ9,"WiFi Extender, 5G 1200Mbps Dual Band WiFi Extenders Signal Booster for Home, Device Servers WiFi Booster Covers Up to 7000 Sq.ft and 20 Devices, 1200Mbps Wireless Signal Repeater with Ethernet (White)",https://m.media-amazon.com/images/I/51w+qzGmUqL._AC_UL320_.jpg,https://www.amazon.com/dp/B0C8JQHNJ9,4.8,0,39.99,49.99,60,False,1000
B098PCVQ52,"ARRIS Surfboard SBG10-RB DOCSIS 3.0 Cable Modem & AC1600 Dual Band Wi-Fi Router, Approved for Cox, Spectrum, Xfinity & Others (RENEWED)",https://m.media-amazon.com/images/I/51jOycpgXAL._AC_UL320_.jpg,https://www.amazon.com/dp/B098PCVQ52,4.0,0,35.18,48.45,60,False,0
B07X1VYRN3,"LIONWEI USB C Hub Adapter for MacBook Pro 2020, Multiport USB Adapter HDMI MacBook Pro Dongle for Card Readers with 4K HDMI, 2 USB 3.0, TF/SD, USB-C 100W and Thunderbolt 3 for MacBook Pro Air",https://m.media-amazon.com/images/I/71ijB54TBwL._AC_UL320_.jpg,https://www.amazon.com/dp/B07X1VYRN3,4.4,0,29.95,36.99,60,False,0
B07MJW5BXZ,"Gotega External DVD Drive, USB 3.0 Portable +/-RW , DVD Player for CD ROM Burner Compatible with Laptop Desktop PC Windows Linux OS Apple Mac Black",https://m.media-amazon.com/images/I/61FN+08I9PL._AC_UL320_.jpg,https://www.amazon.com/dp/B07MJW5BXZ,4.3,0,19.99,32.99,63,True,0
B08166SLDF,"AMD Ryzen 5 5600X 6-core, 12-Thread Unlocked Desktop Processor with Wraith Stealth Cooler",https://m.media-amazon.com/images/I/61twhaihHtL._AC_UL320_.jpg,https://www.amazon.com/dp/B08166SLDF,4.8,0,156.46,309.0,63,True,0
B0BCF57FL5,Intel Core i7-13700K (Latest Gen) Gaming Desktop Processor 16 cores (8 P-cores + 8 E-cores) with Integrated Graphics - Unlocked,https://m.media-amazon.com/images/I/61m0zH-NiTL._AC_UL320_.jpg,https://www.amazon.com/dp/B0BCF57FL5,4.8,0,375.99,419.0,63,False,0
B0BTZB7F88,"AMD Ryzen 7 7800X3D 8-Core, 16-Thread Desktop Processor",https://m.media-amazon.com/images/I/51HqC0rU9HL._AC_UL320_.jpg,https://www.amazon.com/dp/B0BTZB7F88,4.7,0,389.0,449.0,63,False,0
B0BCF54SR1,Intel Core i9-13900K (Latest Gen) Gaming Desktop Processor 24 cores (8 P-cores + 16 E-cores) with Integrated Graphics - Unlocked,https://m.media-amazon.com/images/I/61My4F2-XUL._AC_UL320_.jpg,https://www.amazon.com/dp/B0BCF54SR1,4.7,0,551.99,629.99,63,False,0
B09NCNF2ZQ,CORSAIR VENGEANCE DDR5 RAM 32GB (2x16GB) 5600MHz CL36 Intel XMP iCUE Compatible Computer Memory - Black (CMK32GX5M2B5600C36),https://m.media-amazon.com/images/I/71W0l9URZOL._AC_UL320_.jpg,https://www.amazon.com/dp/B09NCNF2ZQ,4.7,0,94.99,0.0,63,False,0
B0C7JYX6LN,"ASUS TUF Gaming GeForce RTX™ 4090 OG OC Edition Gaming Graphics Card (PCIe 4.0, 24GB GDDR6X, DLSS 3, HDMI 2.1, DisplayPort 1.4a)",https://m.media-amazon.com/images/I/81-Q4kEcj5L._AC_UL320_.jpg,https://www.amazon.com/dp/B0C7JYX6LN,4.2,0,1799.99,0.0,63,False,0
B0BYR1BXC6,Corsair RM750e (2023) Fully Modular Low-Noise Power Supply - ATX 3.0 & PCIe 5.0 Compliant - 105°C-Rated Capacitors - 80 Plus Gold Efficiency - Modern Standby Support - Black,https://m.media-amazon.com/images/I/71XeKGayJaL._AC_UL320_.jpg,https://www.amazon.com/dp/B0BYR1BXC6,4.7,0,99.99,0.0,63,False,0
B07PZR9JLT,Thermaltake Toughpower GF1 850W 80+ Gold SLI/ CrossFire Ready Ultra Quiet 140mm Hydraulic Bearing Smart Zero Fan Full Modular Power Supply 10 Year Warranty PS-TPD-0850FNFAGU-1,https://m.media-amazon.com/images/I/71EBGPzoYkL._AC_UL320_.jpg,https://www.amazon.com/dp/B07PZR9JLT,4.5,0,107.72,139.99,63,False,0
B0BQWSP2ZP,"Corsair iCUE H150i Elite LCD XT Liquid CPU Cooler - IPS LCD Screen - Three AF120 RGB Elite Fans - 360mm Radiator - Fits Intel® LGA 1700, AMD® AM5, and More - Included iCUE Commander CORE - Black",https://m.media-amazon.com/images/I/71EN9Vc-qsL._AC_UL320_.jpg,https://www.amazon.com/dp/B0BQWSP2ZP,4.3,0,249.99,289.99,63,False,0
B07ZCZ4HRT,"Ailun Screen Protector for iPad 9th 8th 7th Generation (10.2 Inch, iPad 9/8/7, 2021&2020&2019) Tempered Glass/Apple Pencil Compatible [2 Pack]",https://m.media-amazon.com/images/I/71QPduoKd1L._AC_UL320_.jpg,https://www.amazon.com/dp/B07ZCZ4HRT,4.6,0,8.98,10.9,64,True,0
B0BHHRH4SG,"iPad Case 10.2 with Keyboard - iPad 9th Generation Case with Keyboard 2021, Built-in Pencil Holder - iPad Keyboard Case 9th/8th/7th Generation - Gold Sand Pattern",https://m.media-amazon.com/images/I/71EA8vrl+aL._AC_UL320_.jpg,https://www.amazon.com/dp/B0BHHRH4SG,4.4,0,28.99,0.0,64,True,0
B08TZTV38C,"FANGOR Car Headrest Mount Holder, Tablet Holder for Kids in Back Seats, Anti-Slip Strap and Holding Net,Angle-Adjustable/Fits All 7 Inch to 12.9 Inch Tablets",https://m.media-amazon.com/images/I/71EBBmBqWQL._AC_UL320_.jpg,https://www.amazon.com/dp/B08TZTV38C,4.6,0,16.99,24.99,64,False,0
B092ZQ7H1K,12 x Universal Capacitive Touchscreen Stylus Pens for Samsung Galaxy Huawei Mi and All Phones Tablets with Capacitive Touch Screen,https://m.media-amazon.com/images/I/71x5-PWbjGL._AC_UL320_.jpg,https://www.amazon.com/dp/B092ZQ7H1K,5.0,0,3.59,0.0,64,False,0
B089SNLPJM,"Electronic Organizer Bag, FINPAC Portable Accessories Storage for Cable/Cord/Charger/USB/SD Card, Portfolio Tablet Sleeve Carrying Case for iPad Pro 12.9''/11/10.2"" iPad/10.5"" iPad Air/9.7"" iPad",https://m.media-amazon.com/images/I/81mcgP0gmAL._AC_UL320_.jpg,https://www.amazon.com/dp/B089SNLPJM,4.6,0,26.99,0.0,64,False,0
B0C9LZC6QH,"iPhone 15 Charger, 30W USB C Fast Charger with 6.6ft Cable for iPhone 15/15 Plus/Pro/Max, iPad Pro Charger Wall Charger for MacBook Air Laptop, iPad Pro/Air/Mini, Samsung, Pixel, Tablet",https://m.media-amazon.com/images/I/51h43gBRWfL._AC_UL320_.jpg,https://www.amazon.com/dp/B0C9LZC6QH,4.3,0,12.99,0.0,64,False,0
B08ZYKD3JH,FINPAC Handbag Briefcase Shoulder Bag with Accessory Pocket Pouch,https://m.media-amazon.com/images/I/71PSW8BSiSL._AC_UL320_.jpg,https://www.amazon.com/dp/B08ZYKD3JH,4.6,0,36.99,0.0,64,False,0
B0BQ98XNPN,"tomtoc 360 Protective Tablet Sleeve for 12.9-inch iPad Pro M2&M1 with Magic Keyboard or Smart Keyboard Folio, Water-Resistant Case Bag with Accessory Pocket",https://m.media-amazon.com/images/I/81d7nsK-bEL._AC_UL320_.jpg,https://www.amazon.com/dp/B0BQ98XNPN,4.8,0,25.99,0.0,64,False,0
B0C1NK98YM,"Tablet Holder for Car Headrest, Adjustable Positions and 360° Rotation Ipad Holder for Car Backseat, Ipad Car Mount for Kids, Ipad Car Holder Back Seat Fit All 5.4-12.9"" Tablets and Cell Phones",https://m.media-amazon.com/images/I/71EB-TGJi2L._AC_UL320_.jpg,https://www.amazon.com/dp/B0C1NK98YM,4.9,0,9.99,11.49,64,False,0
B0BJPN231L,"iPad Pro 11 Inch Accessories Sleeve Case, Protective Travel Tablet Carrying Bag for iPad Pro 11 (2022-2018), iPad 10.9 (10th Gen), iPad Air (5/4th Gen), Galaxy Tab A8/A7/S8/S7 (Navy Blue-11)",https://m.media-amazon.com/images/I/71qH4L9ZgcL._AC_UL320_.jpg,https://www.amazon.com/dp/B0BJPN231L,4.7,0,16.99,0.0,64,False,0
B06XZTZ7GB,"MATEIN Travel Laptop Backpack, Business Anti Theft Slim Durable Laptop Backpack with USB Charging Port, Water Resistant College Bag Computer Bag Gifts for Men & Women Fits 15.6 Inch Notebook, Grey",https://m.media-amazon.com/images/I/81L8quiJXhL._AC_UL320_.jpg,https://www.amazon.com/dp/B06XZTZ7GB,4.7,0,29.99,39.96,65,True,0
B0B1HJ666G,"Mac Book Pro Charger - 118W USB C Charger Fast Charger for USB C Port MacBook pro & MacBook Air, ipad Pro, Samsung Galaxy and All USB C Device, Include Charge Cable（7.2ft/2.2m）",https://m.media-amazon.com/images/I/51cpWg2Ay7L._AC_UL320_.jpg,https://www.amazon.com/dp/B0B1HJ666G,4.7,0,37.99,59.99,65,True,0
B075Y6Y9H5,Laptop Shoulder Bag,https://m.media-amazon.com/images/I/71hrx6vNjPL._AC_UL320_.jpg,https://www.amazon.com/dp/B075Y6Y9H5,4.7,0,15.13,19.99,65,False,0
B09GJJ5C32,Lenovo 40B00135US Thunderbolt 4 ThinkPad Universal Dock 8K Display Support Up to 100W Power Delivery,https://m.media-amazon.com/images/I/41JgtjiSYjL._AC_UL320_.jpg,https://www.amazon.com/dp/B09GJJ5C32,3.6,0,209.0,299.0,65,False,0
B09KXMZXM9,"Universal 65W 45W USB C Laptop Charger-Replacement for Lenovo Thinkpad/Yoga/Chromebook,HP Acer Asus Samsung Mac book pro Dell Chromebook Latitude xps 13 Series,Fast Type C AC Adapter Power Cord Supply",https://m.media-amazon.com/images/I/61wUBM1cYDL._AC_UL320_.jpg,https://www.amazon.com/dp/B09KXMZXM9,4.0,0,17.09,18.99,65,False,0
B07S6CBQJG,"Mac Book air Charger,Replacement for Mac Book Air AC 45W Power T-Tip Shape Connector Power Adapter,Charger for Mac Book Air 11 inch and 13 inch（2012-2017）",https://m.media-amazon.com/images/I/513ipDq519L._AC_UL320_.jpg,https://www.amazon.com/dp/B07S6CBQJG,4.5,0,18.99,0.0,65,False,0
B0BZD63Z9V,"Docking Station for Steam Deck, 7-in-1 Dock with LED Control Button, HDMI2.0 4K@60Hz, DP1.4 4K@120Hz, 100W PD Fast Charge, 1000M Ethernet, 3 USB3.0 Compatible with Valve Steam Deck",https://m.media-amazon.com/images/I/61kvTUNzvIL._AC_UL320_.jpg,https://www.amazon.com/dp/B0BZD63Z9V,5.0,0,72.99,0.0,65,False,0
B09K7LBLXD,"j5create USB C Dual 4K 60Hz Display Docking Station (12-in-1), Built-in M.2 SSD Slot, HDMI, DisplayPort, 10Gbps USB-A, Card Reader, PD 100W, Ethernet, for 2021 MacBook Pro (JCD552)",https://m.media-amazon.com/images/I/61FhsqYTgeL._AC_UL320_.jpg,https://www.amazon.com/dp/B09K7LBLXD,3.5,0,109.99,149.99,65,False,0
B0C58H1CDL,"WAVLINK DisplayLink Laptop Docking Station - Quad Monitor 5K/4K @60Hz, 100W Charging - Thunderbolt 4/3, USB-C/A - M1 M2 Mac/Windows/Chrome/Ubuntu - 4 HDMI, 4 DP, 180W Power, SD 4.0 CR, 2.5Gbps LAN",https://m.media-amazon.com/images/I/61OjVu4M3dL._AC_UL320_.jpg,https://www.amazon.com/dp/B0C58H1CDL,4.2,0,299.99,0.0,65,False,0
B0BYS7T513,"USB C Hub, ORICO 6 in 1 USB C Docking Station with 4K HDMI, 2.5 Gbps Ethernet, 100W PD Charging, 3 USB Port 5 Gbps, Type C Multiport Adapter for MacBook Pro iPad Lenovo Dell Hp Laptop",https://m.media-amazon.com/images/I/71NpYA4Cs3L._AC_UL320_.jpg,https://www.amazon.com/dp/B0BYS7T513,4.6,0,36.99,0.0,65,False,0
B08F7N7J25,"eKL KVM Switch, 8 Port v2.0 HDMI KVM Switch Supports Hotkeys Swapping 4K@60Hz 4:4:4 1080p 3D, 8 in 1 Out 8 PCs Sharing with One Set of Keyboard and Mouse",https://m.media-amazon.com/images/I/71Uc6nzQeZL._AC_UL320_.jpg,https://www.amazon.com/dp/B08F7N7J25,4.0,20,254.99,0.0,66,False,0
B08LHCTQFY,"TESmart KVM Switch DisplayPort, 4 Port KVM Box, UHD 4K@60Hz RGB 4:4:4, USB 2.0 Hub, Hotkey, Button Switching, DP PC Keyboard Mouse Switcher for 4 Computers Sharing 1 Monitor with 5ft Cables",https://m.media-amazon.com/images/I/61baPu4vkSL._AC_UL320_.jpg,https://www.amazon.com/dp/B08LHCTQFY,3.9,63,199.99,0.0,66,False,0
B0CFYR6LXS,"2 Port Displayport KVM Switch Dual Monitor 4K@60Hz 2K@144Hz with Cables, USB 2.0 Hub, Digital Display for 2 Computers 2 Monitors Sharing Keyboard Mouse Video",https://m.media-amazon.com/images/I/61tO0xdsvxL._AC_UL320_.jpg,https://www.amazon.com/dp/B0CFYR6LXS,5.0,6,59.99,0.0,66,False,0
B08NVSW53H,eKL HDMI KVM Switch 4 in 2 Out Dual Monitor Extended Display 4K@60Hz 4:4:4 with Audio and USB 2.0 Hub Sharing PC Monitor Keyboard Mouse Switcher,https://m.media-amazon.com/images/I/71Z17BEGJxL._AC_UL320_.jpg,https://www.amazon.com/dp/B08NVSW53H,3.7,8,169.99,0.0,66,False,0
B09NBBKSCX,eKL KVM Extender HDMI USB 60m/196ft Over UTP Cat5e/6 Ethernet Cable Supports 1080P@60Hz 2 Port USB 2.0 for Computer Plug & Play Without Driver,https://m.media-amazon.com/images/I/717zfTnlppL._AC_UL320_.jpg,https://www.amazon.com/dp/B09NBBKSCX,3.4,4,68.99,0.0,66,False,0
B07PQP4P2F,eKL VGA KVM Switch 8 Port in 2 Out Switcher 8x2 Supports Basic Keyboard and Mouse Audio USB 2.0 Devices Sharing 8 Computers,https://m.media-amazon.com/images/I/61kd4RiK1uL._AC_UL320_.jpg,https://www.amazon.com/dp/B07PQP4P2F,3.7,93,85.99,0.0,66,False,0
B09434SS6L,OWC ThunderBay 8 Thunderbolt 3 Storage Enclosure,https://m.media-amazon.com/images/I/41zeoEweFBS._AC_UL320_.jpg,https://www.amazon.com/dp/B09434SS6L,4.9,13,799.99,0.0,66,False,0
B0C7VBVSW5,"KVM Switch 2 Computers 2 Monitors, 4K@30Hz Dual Monitor HDMI USB 2.0 PC Switcher for 2 Coputers Share Keyboard Mouse and Monitor, Support Copy and Extended Display",https://m.media-amazon.com/images/I/71hbQdP8mDL._AC_UL320_.jpg,https://www.amazon.com/dp/B0C7VBVSW5,3.9,1787,65.99,0.0,66,False,0
B0BQJ68G5K,"JONSBO D41 MESH SC Black ATX Computer Case with Screen, ATX Mainboard/Support RTX 4090(335-400mm) GPU 360/280AIO,Power ATX/SFX: 100mm-220mm Multiple Tool-Free Design,Black",https://m.media-amazon.com/images/I/81NFBPV6czL._AC_UL320_.jpg,https://www.amazon.com/dp/B0BQJ68G5K,4.3,33,158.0,0.0,66,False,0
B0CFYQW5DS,"2 Port Dual Monitor KVM Switch Displayport 1.4 Support 8K@30Hz 4K@144Hz, USB 3.0 DP KVM Switch 2 Monitors 2 Computers with Cables, Digital Display, Wired Remote",https://m.media-amazon.com/images/I/61EFoHQOEaL._AC_UL320_.jpg,https://www.amazon.com/dp/B0CFYQW5DS,5.0,0,99.0,0.0,66,False,0
B09L4NS41L,"Misxi 2 Pack PC Case with Tempered Glass Screen Protector Compatible with Apple Watch Series 9 (2023) Series 8 Series 7 45mm, Ultra-Thin Scratch Resistant Cover for iWatch, 1 Black+1 Transparent",https://m.media-amazon.com/images/I/81-RDEIf2lL._AC_UL320_.jpg,https://www.amazon.com/dp/B09L4NS41L,4.5,0,11.99,0.0,68,True,0
B09TFKQG5M,"6 Pack Sport Bands Compatible with Apple Watch Band 38mm 40mm 41mm 42mm 44mm 45mm 49mm,Soft Silicone Waterproof Strap Compatible with iWatch Apple Watch Series 9 Ultra 8 7 6 5 4 3 2 1 SE Women Men",https://m.media-amazon.com/images/I/71MkC1MO8XL._AC_UL320_.jpg,https://www.amazon.com/dp/B09TFKQG5M,4.7,0,14.98,18.98,68,True,0
B0C5TT2VGP,Elderly 4G GPS Smartwatch Waterproof Worldwide Real-Time Tracking Phone Video Call and Text SOS Emergency Alarm Voice Message Camera Geo-Fence Pedometer Anti-Lost GPS Tracker 3-15 Birthday Gift,https://m.media-amazon.com/images/I/71gEK7rUP8L._AC_UL320_.jpg,https://www.amazon.com/dp/B0C5TT2VGP,3.7,204,89.99,0.0,68,False,0
B0C9LZX23W,"Gixxted Bluetooth Headset, Trucker Bluetooth Headset with Noise Canceling Microphone, 60 Hours Working Time Wireless on-Ear Headset for Computer Cell Phone Trucker Home Office Work (Black)",https://m.media-amazon.com/images/I/816ePYoT7GL._AC_UL320_.jpg,https://www.amazon.com/dp/B0C9LZX23W,4.8,232,29.99,0.0,68,False,0
B08WVDLTZY,"TickTalk 4 Unlocked 4G LTE Kids Smart Watch Phone with GPS Tracker, Combines Video, Voice and Wi-Fi Calling, Messaging, 2X Cameras & Free Streaming Music",https://m.media-amazon.com/images/I/61vdio8YX6L._AC_UL320_.jpg,https://www.amazon.com/dp/B08WVDLTZY,4.0,2284,199.99,0.0,68,False,0
B08PK9YW4G,"Wongeto Compatible with Fitbit Inspire 2 & Inspire/Inspire HR Bands for Women Girls, Resin Strap with Stainless Steel Buckle Replacement Bands for Fitbit Inspire accssorises (Rose Gold+Tortoise)",https://m.media-amazon.com/images/I/61AeZbM5wNL._AC_UL320_.jpg,https://www.amazon.com/dp/B08PK9YW4G,4.4,710,16.99,0.0,68,False,0
B0B17ZLYLB,"22mm Bands Compatible with Samsung Galaxy Watch 3 45mm Band/Galaxy Watch 46mm/Gear S3 Frontier, Stretchy Adjustable Elastic Nylon Woven Sport Loop 22mm Wristband for Men Women, 5 Packs",https://m.media-amazon.com/images/I/81w81LEglQL._AC_UL320_.jpg,https://www.amazon.com/dp/B0B17ZLYLB,4.4,352,14.99,0.0,68,False,0
B0BBP4P8FR,"Bluetooth Headset with Microphone,Trucker Bluetooth Headset with Noise Cancelling,50Hrs Call Time,CVC8.0 Dual Mic, V5.1, Wireless Headset with Paddle Mute,On Ear Headphones for PC,Laptop,Cell Phones",https://m.media-amazon.com/images/I/61xt4+Q1QpL._AC_UL320_.jpg,https://www.amazon.com/dp/B0BBP4P8FR,4.0,114,26.99,29.99,68,False,0
B0BR8FJ1KC,"CHARMINGO Boho Leather Band Compatible with Apple Watch Band Beaded Bracelet for Women Men 38mm/40mm/41mm 42mm/44mm/45mm/49mm, Multilayer Wrap Apple Watch Strap for Iwatch Band Series 8 7 6 5 4 3 2 1 SE Ultra",https://m.media-amazon.com/images/I/71HgxOCJyFL._AC_UL320_.jpg,https://www.amazon.com/dp/B0BR8FJ1KC,4.2,85,25.88,0.0,68,False,0
B0C542YLLX,Luxury Metal Case for Apple Watch Ultra 49mm Band with Cover Heavy Duty Rugged Case Silicon Strap for men Full Protective Cover,https://m.media-amazon.com/images/I/71bpsEf6ZtL._AC_UL320_.jpg,https://www.amazon.com/dp/B0C542YLLX,4.2,18,72.99,0.0,68,False,0
B07FB6VW1M,Mdbebbron 120 inch Projection Screen 16:9 Foldable Anti-Crease Portable Projector Movies Screens for Home Theater Outdoor Indoor Support Double Sided Projection,https://m.media-amazon.com/images/I/81lKMedjwaS._AC_UL320_.jpg,https://www.amazon.com/dp/B07FB6VW1M,4.5,31842,25.99,35.99,69,True,0
B006LW0W5Y,"Amazon Basics 16-Gauge Speaker Wire Cable, 100 Feet, Bronze",https://m.media-amazon.com/images/I/718x1vTL4EL._AC_UL320_.jpg,https://www.amazon.com/dp/B006LW0W5Y,4.7,67758,16.44,0.0,69,True,0
B08RYJCM8S,Zmstlamp VLT-HC910LP VLT-HC100LP VLT-EX100LP Replacement Projector Lamp Bulb for Mitsubishi HC1100 HC1100U HC1500 HC1500U HC1600 HC1600U HC3000 HC3100 HC3000U HC910 HC910U HD1000 HD1000U with Housing,https://m.media-amazon.com/images/I/71GDvi7q4kL._AC_UL320_.jpg,https://www.amazon.com/dp/B08RYJCM8S,3.8,25,47.99,0.0,69,False,0
B084ZMGTH6,EWO'S ELP50 Replacement Projector Lamp for Epson ELPLP50/V13H010L50 Powerlite 84 84+ 825 825+ 826W 826W+ 85 85+ Lamp Bulb Replacement,https://m.media-amazon.com/images/I/61uy53WuCsL._AC_UL320_.jpg,https://www.amazon.com/dp/B084ZMGTH6,4.6,13,59.99,0.0,69,False,0
B094VBTRRT,VEVOR Movie Screen with Stand 180inch Portable Projector Screen 16:9 4K HD Wide Angle Outdoor Projector Screen with Stand Easy Assembly with Storage Bag for Indoor and Outdoor Use,https://m.media-amazon.com/images/I/71DOPXxzO0L._AC_UL320_.jpg,https://www.amazon.com/dp/B094VBTRRT,4.2,126,199.99,0.0,69,False,0
B0B8YZ5TR4,"Perlegear UL Listed Full Motion TV Wall Mount for Most 37–82 inch Flat Curved TVs up to 110 lbs, 12″/16″ Wood Studs, TV Mount Bracket with Articulating Arms, Swivel, Tool-Free Tilt, Max VESA 600x400mm",https://m.media-amazon.com/images/I/61j7MbimFsL._AC_UL320_.jpg,https://www.amazon.com/dp/B0B8YZ5TR4,4.8,1864,45.99,69.99,69,False,0
B08D1VF18M,"LG Remote Magic Remote Control, Compatible with Many LG Models, Netflix and Prime Video Hot Keys, Google/Alexa",https://m.media-amazon.com/images/I/51OmsZo+ppL._AC_UL320_.jpg,https://www.amazon.com/dp/B08D1VF18M,4.4,8201,31.5,49.99,69,False,0
B07M9BKHNZ,Google Chromecast (3rd Generation) Media Streamer - Black,https://m.media-amazon.com/images/I/61o5Ho2Iy5L._AC_UL320_.jpg,https://www.amazon.com/dp/B07M9BKHNZ,4.3,19726,35.59,49.99,69,False,0
B0882WGSRR,"ELIVED UL Listed Full Motion TV Monitor Wall Mount for Most 14-42 Inch LED LCD Flat Screen TVs & Monitors, Swivels Tilts Extension Rotation, TV Bracket Max VESA 200x200mm, up to 33 lbs.",https://m.media-amazon.com/images/I/61n3Ls7-0XL._AC_UL320_.jpg,https://www.amazon.com/dp/B0882WGSRR,4.6,5458,21.99,27.99,69,False,0
B08HQ8VY3Q,"Universal Remote Control Compatible for Samsung Smart-TV LCD LED UHD QLED 4K HDR TVs, with Netflix, Prime Video Buttons",https://m.media-amazon.com/images/I/51sc9zldPCL._AC_UL320_.jpg,https://www.amazon.com/dp/B08HQ8VY3Q,4.3,9809,12.97,0.0,69,False,0
B07QZT6KRD,"Garmin 010-02156-00 Forerunner 45s, 39MM Easy-to-Use GPS Running Watch with Garmin Coach Free Training Plan Support, White",https://m.media-amazon.com/images/I/51raZnazvRL._AC_UL320_.jpg,https://www.amazon.com/dp/B07QZT6KRD,4.5,0,131.34,169.99,70,False,0
B074ZSGKSV,"Escort EZ Mag Mount - StickyCup Silicon Suction Cup (Black) for Escort Models IX, IXC, Max 360c, Redline EX, Max 3, and Max 360",https://m.media-amazon.com/images/I/61j9Xa04AuL._AC_UL320_.jpg,https://www.amazon.com/dp/B074ZSGKSV,4.5,0,29.95,0.0,70,False,0
B089YVVLSW,"Garmin 010-02293-10 Instinct Solar, Rugged Outdoor Smartwatch with Solar Charging Capabilities, Built-in Sports Apps and Health Monitoring, Graphite",https://m.media-amazon.com/images/I/519pESH--lL._AC_UL320_.jpg,https://www.amazon.com/dp/B089YVVLSW,4.6,0,266.54,349.99,70,False,0
