asin,title,imgUrl,productURL,stars,reviews,price,listPrice,sub_category_id,isBestSeller,boughtInLastMonth
B07D4J1MQ4,Paxcoo 1mm Elastic Bracelet String Cord Stretch Bead Cord for Jewelry Making and Bracelet Making White,https://m.media-amazon.com/images/I/517YQJNAMeS._AC_UL320_.jpg,https://www.amazon.com/dp/B07D4J1MQ4,4.4,0,6.99,13.99,1,True,20000
B01LIJED4U,"Pro Size Polishing Cleaning Cloth Pure Cotton Made in USA for Gold, Silver, and Platinum Jewelry, Eco Friendly Large Cleaner Cloth 11 x 14 in. Keeps Jewelry Clean and Shiny",https://m.media-amazon.com/images/I/91C3CcGnOkL._AC_UL320_.jpg,https://www.amazon.com/dp/B01LIJED4U,4.7,0,10.95,0.0,1,True,8000
B08YNTXFJG,Duufin 120 Pieces Acrylic Keychain Blanks Set Including 40 Pieces Rectangle Acrylic Ornament Blanks (3 x 7cm) 40 Pieces Key Rings with Chain and 40 Pieces Jump Rings for DIY Projects and Craft,https://m.media-amazon.com/images/I/71czFH2QUML._AC_UL320_.jpg,https://www.amazon.com/dp/B08YNTXFJG,4.7,510,9.99,0.0,1,False,50
B08DXSF5PZ,"DIY Tray Silicone Resin Mold, Oval Epoxy Resin Casting Mold, Craft Jewelry Making Tools, Jewelry Plate Dish Casting Mold for Crafts Supplies",https://m.media-amazon.com/images/I/71ZnrCHA49L._AC_UL320_.jpg,https://www.amazon.com/dp/B08DXSF5PZ,4.6,584,8.99,0.0,1,False,0
B096JGXQN5,"GTOTd I Love Rock and Roll Pins Set(18 Pack,2.28 Inch）Cool Brand Brooch Pin Badges Music Singer Pins for Clothing Bags Backpack Jackets Accessories Supplies DIY Crafts",https://m.media-amazon.com/images/I/71SOJXp-wJL._AC_UL320_.jpg,https://www.amazon.com/dp/B096JGXQN5,4.5,245,12.79,0.0,1,False,50
B0BZXW1ZGS,"Xuhal 100 Pack Plastic Ring Sizer Bulk Reusable Finger Size Gauge Measure Plastic Ring Measurement Tool Jewelry Ring Sizing Kit Finger Measurer for Men and Women, 1-17 USA Rings Size White and Black",https://m.media-amazon.com/images/I/81qD7tFV+rL._AC_UL320_.jpg,https://www.amazon.com/dp/B0BZXW1ZGS,5.0,1,16.99,0.0,1,False,0
B0BR8B472F,"Large Dice Resin Molds, 2 Styles Silicone Dice Mold for Epoxy Resin Casting, Triangle Hexagonal D20 D12 Dice Game Mold with Number, Silicone Resin Candle Mold for DIY Art Craft Home Decor",https://m.media-amazon.com/images/I/71uDVuhf71L._AC_UL320_.jpg,https://www.amazon.com/dp/B0BR8B472F,4.4,10,15.99,0.0,1,False,50
B096HTDZR5,"10 Pieces 25 mm Bezel Tray Blank Bangle Bracelet Bezel Blank Settings Adjustable Round Bracelet for Jewelry Making DIY Handmade, Men and Women (Silver)",https://m.media-amazon.com/images/I/71M5IJaWA2S._AC_UL320_.jpg,https://www.amazon.com/dp/B096HTDZR5,4.4,130,14.99,0.0,1,False,0
B07SVCV8VB,100pcs Adabele Authentic 925 Sterling Silver Crimp Beads 1.6mm Smooth Tiny Tubes Spacer (Hole 0.9mm) for Jewelry Making SS241-1,https://m.media-amazon.com/images/I/51wAAOtlbzL._AC_UL320_.jpg,https://www.amazon.com/dp/B07SVCV8VB,4.5,82,10.49,0.0,1,False,0
B0B4689HLD,90 Pcs Antique Silver Jesus Mary Religious Benedict Medallion Mexican Spacer Beads Charms Pendants for Jewelry Making DIY Rosary Necklace Bracelet (M716),https://m.media-amazon.com/images/I/713kgDwf7nL._AC_UL320_.jpg,https://www.amazon.com/dp/B0B4689HLD,4.6,65,8.99,0.0,1,False,0
B0721PY3M9,"Zenacolor 20 Fabric Markers Pens Set - Non Toxic, Indelible and Permanent Fabric Paint Fine Point Textile Marker Pen - Pens Fine Point Tip",https://m.media-amazon.com/images/I/91md7iVF6YL._AC_UL320_.jpg,https://www.amazon.com/dp/B0721PY3M9,4.4,8261,7.99,14.99,2,True,3000
B004BQ01CQ,"Tulip Dimensional Fabric Paint 41401 Dfpt 4Oz Slick Black, 4 Fl Oz (Pack of 1)",https://m.media-amazon.com/images/I/615w-cWLgKL._AC_UL320_.jpg,https://www.amazon.com/dp/B004BQ01CQ,4.6,1833,3.98,0.0,2,True,1000
B01FV60TAS,"Tulip One-Step Tie-Dye Party, 18 Pre-Filled Bottles, Creative Group Activity, All-in-1 Fashion Design Kit, 1 Pack, Rainbow",https://m.media-amazon.com/images/I/81IU-Oqb81L._AC_UL320_.jpg,https://www.amazon.com/dp/B01FV60TAS,4.8,33980,19.34,41.29,2,False,3000
B00UY194NE,Tulip ColorShot Instant Fabric Spray Color 3oz. Black,https://m.media-amazon.com/images/I/61EaMHdcFCL._AC_UL320_.jpg,https://www.amazon.com/dp/B00UY194NE,4.3,3446,5.98,7.99,2,False,2000
B00KIN1JKE,"Tulip One-Step Tie-Dye Kit Party Supplies, 18 Bottles Tie Dye, Rainbow, 1 Count (Pack of 1)",https://m.media-amazon.com/images/I/913nuoCMibL._AC_UL320_.jpg,https://www.amazon.com/dp/B00KIN1JKE,4.8,10809,17.48,29.99,2,False,2000
B004LK0WEO,"sunacme Fabric Markers Pen, 32 Colors Permanent Fabric Paint Pens Art Markers Set - Fine Tip, Child Safe & Non- Toxic for Canvas, Bags, T-Shirts, Sneakers",https://m.media-amazon.com/images/I/71NBN0Th9HL._AC_UL320_.jpg,https://www.amazon.com/dp/B004LK0WEO,4.5,2827,13.99,17.99,2,False,2000
B00LEM6UOI,Green Water Tracing & Leak Detection Flourescent Dye - 1 Gallon,https://m.media-amazon.com/images/I/71rJy-XCZsL._AC_UL320_.jpg,https://www.amazon.com/dp/B00LEM6UOI,4.4,737,38.99,0.0,2,False,0
B00K1QKS0K,"Rit Dye Liquid Fabric Dye, 8 fl oz, Black, 2-Pack",https://m.media-amazon.com/images/I/715d4t56p6L._AC_UL320_.jpg,https://www.amazon.com/dp/B00K1QKS0K,4.3,1491,15.99,0.0,2,False,1000
B08Y98RH3P,Synthetic Rit Dye More Liquid Fabric Dye – Wide Selection of Colors – 7 Ounces - Graphite,https://m.media-amazon.com/images/I/51ctYafLcmL._AC_UL320_.jpg,https://www.amazon.com/dp/B08Y98RH3P,4.3,3098,9.38,0.0,2,False,1000
B07W5SBXRM,"Fabric Markers, Fabric Marker Permanent for T Shirts Clothes Pillow Canvas, Fabric Paint Pens for Kids - No Bleed, Fine Tip, Set of 30 Colors",https://m.media-amazon.com/images/I/71YjcYq2jsL._AC_UL320_.jpg,https://www.amazon.com/dp/B07W5SBXRM,4.4,2785,9.99,14.99,2,False,1000
B07RNNL6RT,"Yarniss 14 Size Crochet Hooks Set,MultiColor,2mm(B)-10mm(N) Ergonomic Crochet Hooks with Case for Arthritic Hands, Extra Long Crochet Needles",https://m.media-amazon.com/images/I/613NGjZe59L._AC_UL320_.jpg,https://www.amazon.com/dp/B07RNNL6RT,4.8,18222,16.99,22.99,3,True,5000
B09XBNGC7D,Knit Picks Hand Operated Yarn Ball Winder (Purple),https://m.media-amazon.com/images/I/51OfY9zeuiL._AC_UL320_.jpg,https://www.amazon.com/dp/B09XBNGC7D,4.4,1555,21.98,0.0,3,True,3000
B0033P75ES,Red Heart Super Saver Yarn (3-Pack) Medium Thyme E300-406,https://m.media-amazon.com/images/I/81F0nsiSKpL._AC_UL320_.jpg,https://www.amazon.com/dp/B0033P75ES,4.7,0,23.88,0.0,3,False,0
B000QHFA02,"Susan Bates Silvalume Aluminum Crochet Hook 5.5"", Size E4/3.5mm",https://m.media-amazon.com/images/I/713jOu8isuL._AC_UL320_.jpg,https://www.amazon.com/dp/B000QHFA02,4.4,0,5.61,0.0,3,False,0
B09B1FPD5G,Double Wooden Yarn Skein Holder,https://m.media-amazon.com/images/I/71vp0dOSRVL._AC_UL320_.jpg,https://www.amazon.com/dp/B09B1FPD5G,4.5,0,37.99,0.0,3,False,0
B01JBL61MY,"addi Click Rocket Lace Standard 5-Inch Interchangeable Circular Knitting Needle Set Sizes US 4, 5, 6, 7, 8, 9, 10 and 11, 3 Blue Cords, Pink Canvas Case Bundle with 1 Artsiga Crafts Project Bag",https://m.media-amazon.com/images/I/814P5VThuCL._AC_UL320_.jpg,https://www.amazon.com/dp/B01JBL61MY,4.5,0,157.81,0.0,3,False,0
B09X2FXGPX,"Zerodis 12Pcs Tunisian Crochet Hooks Set, ABS Plastic Afghan Tunisian Crochet Hook Set with Cable Carpet Rug Weave Knitting Needles Plastic Tunisian Circular for Afghan Crocheting",https://m.media-amazon.com/images/I/71sfua5zsEL._AC_UL320_.jpg,https://www.amazon.com/dp/B09X2FXGPX,3.4,0,10.0,0.0,3,False,0
B0BGNQMT2B,4Pcs Double Ended Dreadlock Crochet Hook for Hair 2Pcs Dreadlock Needle Tool 1Hook 2Hooks (0.5mm+ 0.75mm) 2Pcs Hair Locking Tool for Braid Craft,https://m.media-amazon.com/images/I/61nNoJRUpAL._AC_UL320_.jpg,https://www.amazon.com/dp/B0BGNQMT2B,3.6,0,10.99,0.0,3,False,0
B0C3H99STZ,Crochet Kit for Beginners Crochet Animals Kit Crafts for Adults Kids Complete Crochet Set Knitting Kit with Step-by-Step Video Tutorials Detailed Instructions Enough Yarn,https://m.media-amazon.com/images/I/71Pc9IZA-PL._AC_UL320_.jpg,https://www.amazon.com/dp/B0C3H99STZ,5.0,0,9.79,13.99,3,False,0
B09X1WGVFF,"Embroidery Crochet Hooks with 3 Needles, Tambour Hook Embroidery Needle, French Crochet Embroidery Beading Tool Set, Embroidery Beading Needle Tools Sequin Beads(Wooden French Embroidery Needle)",https://m.media-amazon.com/images/I/61EEaFxIXtL._AC_UL320_.jpg,https://www.amazon.com/dp/B09X1WGVFF,4.2,0,8.7,0.0,3,False,0
B0BLYY563F,"Hiipoo 8 Pack Sublimation Tumblers Blank 20 oz Straight Skinny with Sublimation Papers, Lids and Straws, Shrink Wrap, Stainless Steel Double Wall Insulated Tumbler for Tumbler Press Machine",https://m.media-amazon.com/images/I/81RpCsbQF7L._AC_UL320_.jpg,https://www.amazon.com/dp/B0BLYY563F,4.8,776,35.99,39.99,4,True,3000
B09Q5N8ZHB,"Godora DTF Powder White Digital Transfer Hot Melt Adhesive, DTF PreTreat Transfer Powder for Black or Dark Colored Garments, DTF Hot Melt Adhesive Powder for All DTF and DTG Printers, 450g - 16oz",https://m.media-amazon.com/images/I/51WdKO2IreL._AC_UL320_.jpg,https://www.amazon.com/dp/B09Q5N8ZHB,4.6,1062,20.88,35.99,4,True,3000
B003IG27OK,"Speedball Block Printing Baren - Comfortable Wooden Handle, Made in the USA - 4 Inches",https://m.media-amazon.com/images/I/71u+819tqTL._AC_UL320_.jpg,https://www.amazon.com/dp/B003IG27OK,4.7,727,29.99,33.39,4,False,200
B07RSBKDLW,"INTBUYING 110V 1200W Screen Printing Screen Drying Cabinet Screen Frame Assembly Plate Drying Equipment Silk Screen Printmaking 16"" x24""",https://m.media-amazon.com/images/I/515RkYCxc+S._AC_UL320_.jpg,https://www.amazon.com/dp/B07RSBKDLW,3.4,19,169.99,0.0,4,False,0
B07GYNH35Y,SmarketBuy Heat Press 15x15 Inch Digital Sublimation T-Shirt Heat Press Machine for Hat Mug Plate (5 in 1),https://m.media-amazon.com/images/I/71TERzHuG0L._AC_UL320_.jpg,https://www.amazon.com/dp/B07GYNH35Y,4.1,937,199.99,0.0,4,False,0
B08XYQXWRX,"8 Pack Straight Sublimation Tumblers bulk 20 oz Skinny,Stainless Steel Double Wall Insulated Tumbler Cups Blank White with Lid, Straw, Individually Boxed,Polymer Coating for Heat Transfer",https://m.media-amazon.com/images/I/61Ls0-YaBLL._AC_UL320_.jpg,https://www.amazon.com/dp/B08XYQXWRX,4.7,3229,35.99,39.99,4,False,2000
B08NVF2MMF,PYD Life Sublimation Blanks Skinny Tumbler White 20 OZ Straight Stainless Steel Tumbler with Metal Straw for Mug Tumbler Heat Press Machine Sublimation Printing 4 Pack,https://m.media-amazon.com/images/I/51zW4sJQeTL._AC_UL320_.jpg,https://www.amazon.com/dp/B08NVF2MMF,4.8,3247,32.76,0.0,4,False,2000
B0C1S5QT44,"HTVRONT Sublimation HTV for Dark Fabric/Light Fabric - Matte Sublimation Vinyl 12"" X 5FT - Sublimation Blanks for Sublimation Shirts/Bag/Hat/Pillow…",https://m.media-amazon.com/images/I/51cqjdybfGL._AC_UL320_.jpg,https://www.amazon.com/dp/B0C1S5QT44,4.6,182,11.99,0.0,4,False,3000
B07YDNKSH6,"4-Inch Rubber Brayer Roller for Printmaking, Great for Gluing Application Also. (Original Version)",https://m.media-amazon.com/images/I/61go-tTwlQL._AC_UL320_.jpg,https://www.amazon.com/dp/B07YDNKSH6,4.7,7404,7.99,10.99,4,False,2000
B07VKPZS24,"Cricut EasyPress Mini Heat Press for Pressing Small Objects like Shoes, Stuffed Animals, Hats & More, 3 Heat Settings & Precision Tip, Ceramic-Coated Heat Plate, Compact & Lightweight, Raspberry",https://m.media-amazon.com/images/I/61wtIEveKNL._AC_UL320_.jpg,https://www.amazon.com/dp/B07VKPZS24,4.8,32987,49.0,69.99,4,False,1000
B00LJV1JK4,"Cricut Premium Fine-Point Replacement Blade, Cutting Blade with Improved Design, Cuts Light to Mid-Weight Materials, For Personalized Crafts, Compatible Maker & Explore Machines, 1 Count",https://m.media-amazon.com/images/I/71BJfvkHNaL._AC_UL320_.jpg,https://www.amazon.com/dp/B00LJV1JK4,4.8,0,5.69,14.99,5,True,3000
B0BHL2CPHX,"Photo Album Self Adhesive with Picture Display Window,40 Pages DIY Scrapbook Album for 4x6-8x10 Picture,Linen Cover Memory Book for Wedding Family, with Scraper and Metallic Pen",https://m.media-amazon.com/images/I/81IprYC1y9L._AC_UL320_.jpg,https://www.amazon.com/dp/B0BHL2CPHX,4.7,0,17.99,19.99,5,True,2000
B07Y73ZNYG,8 Colors Rainbow Washable Large Ink Pads for Rubber Stamps Kids (Pack of 8),https://m.media-amazon.com/images/I/81uGh4Y56PL._AC_UL320_.jpg,https://www.amazon.com/dp/B07Y73ZNYG,4.0,0,19.97,0.0,5,False,0
B09D72MCYK,"1200Pcs Paper Fasteners Kit 5 Sizes Brads Round Fasteners Metal Paper Fasteners Brass Plated Brads Fasteners for Scrapbooking Crafts DIY Paper(Gold, Silver, Bronze, Black)",https://m.media-amazon.com/images/I/81pDBOcf5DL._AC_UL320_.jpg,https://www.amazon.com/dp/B09D72MCYK,4.9,0,17.97,0.0,5,False,0
B07Q1NGPV9,"Ink Pads for Rubber Stamps, Rubber Stamps Pads- Permanent, Waterproof, Stamp Pads for Card Making, Scrapbooking Supplies, Christmas Ink Stamps, Hand Stamp Ink Pad, Non-Toxic (5 Ink Pad Bundles)",https://m.media-amazon.com/images/I/71z8I8MheRL._AC_UL320_.jpg,https://www.amazon.com/dp/B07Q1NGPV9,4.2,0,37.99,0.0,5,False,0
B07STGLY6J,"Cricut Basic Tool Set - Precision Tool Kit for Crafting and DIYs, Perfect for Vinyl, Paper & Iron-on Projects, Great Companion for Cricut Cutting Machines, Core Colors, 10.25 x 6.5 x 0.75, 5-Piece",https://m.media-amazon.com/images/I/71u5TDp0l1L._AC_UL320_.jpg,https://www.amazon.com/dp/B07STGLY6J,4.9,0,10.99,25.19,5,False,2000
B001A42CTW,"Fiskars SoftGrip Detail Craft Knife - 8"" Exacto Knife for Crafting - Multi-Use Exacto Blade Included with Protective Cover",https://m.media-amazon.com/images/I/41jn4bakM9L._AC_UL320_.jpg,https://www.amazon.com/dp/B001A42CTW,4.6,0,5.97,7.99,5,False,3000
B0C6PWRZGK,"2023 New Stamps and Dies for Card Making,Metal Die-Cuts Card Making Supplies,Adult DIY Scrapbooking Arts Crafts Stamping for Gift Easter Valentine's Day Fathers' Day (5659)",https://m.media-amazon.com/images/I/71gBjNIKzqL._AC_UL320_.jpg,https://www.amazon.com/dp/B0C6PWRZGK,4.9,0,11.99,0.0,5,False,0
B09HBVBSMS,"445 PCS Vintage Scrapbook Paper Journaling Scrapbooking Supplies Kit Aesthetic Decorative Craft Paper include 40 Sheet Flowers Stickers for Planner, Bullet Journaling, Junk Journal, Retro Crafts",https://m.media-amazon.com/images/I/81BXujPv3hL._AC_UL320_.jpg,https://www.amazon.com/dp/B09HBVBSMS,4.5,0,11.99,20.99,5,False,1000
B09YRR5W5C,"348 Pcs Scrapbooking Supplies Kit, Vintage Aesthetic Scrapbook Kit for Bullet Junk Journal, Stationery, A6 Grid Notebook, DIY Journaling Supplies, Birthday Craft Gift for Teen Girl Kid Women",https://m.media-amazon.com/images/I/81jboFUKW7L._AC_UL320_.jpg,https://www.amazon.com/dp/B09YRR5W5C,4.5,0,14.99,20.99,5,False,200
B0B58FGF8H,"Art3d 16 Sets Hook and Loop Tape Sticky Back,1 in.x 4 in. Double-Sided Command Adhesive Strip Heavy Duty",https://m.media-amazon.com/images/I/71XjZBhX-8L._AC_UL320_.jpg,https://www.amazon.com/dp/B0B58FGF8H,4.4,0,6.49,0.0,6,True,10000
B0892SWQB5,"Mr. Pen- Safety Pins, Assorted, 300 Pack, Small and Large for Clothes, 5.4 x 4.4 x 0.7 inch",https://m.media-amazon.com/images/I/61lG4r6oGsL._AC_UL320_.jpg,https://www.amazon.com/dp/B0892SWQB5,4.6,0,4.95,5.99,6,True,10000
B07MT89MCW,"GDMINLO Soft Tape Measure Double Scale Body Sewing Flexible Ruler for Weight Loss Medical Body Measurement Sewing Tailor Craft Vinyl Ruler, Has Centimetre Scale on Reverse Side 60-inch（White）",https://m.media-amazon.com/images/I/61vysAVtFBL._AC_UL320_.jpg,https://www.amazon.com/dp/B07MT89MCW,4.8,0,3.59,8.88,6,False,30000
B004ALQ0M2,"Fairfield The Original Poly-Fil Premium Polyester Fiber Fill, Soft Pillow Filler, Stuffed Animals, Toys, Cloud Decorations, and More, Machine-Washable, 32-ounce Bag, White",https://m.media-amazon.com/images/I/81UmvHwHHWL._AC_UL320_.jpg,https://www.amazon.com/dp/B004ALQ0M2,4.8,0,14.87,0.0,6,False,7000
B0992HY6KY,"250 Pack Safety Pins by Luxurecourt, 4 Assorted Sizes of Durable, Silver Small and Large Safety Pins Bulk, Rust-Resistant Nickel Plated Steel, Sharp Edge Safety Pins for Clothes, Sewing, Arts & Craft",https://m.media-amazon.com/images/I/71L1cLv4oaL._AC_UL320_.jpg,https://www.amazon.com/dp/B0992HY6KY,4.5,0,5.99,10.55,6,False,7000
B08GM954K3,"Wenrook 300 Pack Safety Pins Assorted, 4 Different Sizes, Strong Nickel Plated Steel, Heavy Duty Safety Pins for Clothes, Crafts, Pinning and More",https://m.media-amazon.com/images/I/81-fby72vcL._AC_UL320_.jpg,https://www.amazon.com/dp/B08GM954K3,4.5,0,4.99,6.99,6,False,8000
B0716K2W1K,"ZEFFFKA Premium Quality Denim Iron-on Jean Patches Inside & Outside Strongest Glue 100% Cotton Assorted Shades of Blue Repair Decorating Kit 12 Pieces Size 3"" by 4-1/4"" (7.5 cm x 10.5 cm)",https://m.media-amazon.com/images/I/A1rdWM4dsmL._AC_UL320_.jpg,https://www.amazon.com/dp/B0716K2W1K,4.3,0,8.99,9.99,6,False,5000
B0B714DRFT,"Sewing Kit Gifts for Grandma, Mom, Friend, Traveler, Adults, Beginner, Emergency,Sewing Supplies Accessories with Scissors,Sewing Needles Thimble, Thread,Tape Measure etc (Black, S)",https://m.media-amazon.com/images/I/81z1RwGr79L._AC_UL320_.jpg,https://www.amazon.com/dp/B0B714DRFT,4.6,0,5.99,0.0,6,False,7000
B098HXCJNQ,"Safety Pins Assorted, 340-Pack 5 Different Sizes Large Safety Pins Heavy Duty Safety Pin, Safety Pins for Clothes Pins, Small Safety Pins for Sewing, Halloween Costume, Arts and Crafts Supplies",https://m.media-amazon.com/images/I/81r1UA0tTIL._AC_UL320_.jpg,https://www.amazon.com/dp/B098HXCJNQ,4.5,0,4.95,7.42,6,False,6000
B07XNYCYJN,GDMINLO Soft Tape Measuring for Body Fabric Sewing Tailor Cloth Knitting Craft Weight Loss Measurements Retractable Black Dual Sided Tape Measure 1 Pack,https://m.media-amazon.com/images/I/51bU6XcvhFL._AC_UL320_.jpg,https://www.amazon.com/dp/B07XNYCYJN,4.4,0,3.99,0.0,6,False,6000
B0C7VQZZSV,"10PCS Self Adhesive Felt, DIY Self Adhesive Fabric for Art & Crafts, Peel and Stick Felt for Drawer/Jewelry Box Felt Liner, A4 Size (8.3"" x 11.8"", Pink)",https://m.media-amazon.com/images/I/71Fh+MwsYWL._AC_UL320_.jpg,https://www.amazon.com/dp/B0C7VQZZSV,4.6,0,8.99,9.99,7,True,0
B0B7WQ349S,"-25 Options- 100% Cotton Quilting Fabric Bundles 10pcs Fat Quarters 18”x21”-Medium Weight 5.2 oz- for Quilting, Sewing Project, Patchwork, DIY Crafts – Starry Sky",https://m.media-amazon.com/images/I/A1ptzAe0LKL._AC_UL320_.jpg,https://www.amazon.com/dp/B0B7WQ349S,4.7,0,21.99,0.0,7,True,100
B01N1U85M1,"flic-flac 48PCS 8 x 12 inches (20 x 30cm) Assorted Color Felt Fabric Sheets Patchwork Sewing DIY Craft 1mm Thick … (20cm * 30cm, 48pcs)",https://m.media-amazon.com/images/I/61BcbZ-6X6L._AC_UL320_.jpg,https://www.amazon.com/dp/B01N1U85M1,4.6,0,17.28,0.0,7,False,900
B009K4MTII,"AK TRADING CO. 40"" Wide x 5 Yards (15 Feet) - Multipurpose Natural Burlap Fabric - for Decorations, Crafts, Home, Weddings, Table Linens, Landscaping, Plants & Tree Covering and More.",https://m.media-amazon.com/images/I/91awTze1uIL._AC_UL320_.jpg,https://www.amazon.com/dp/B009K4MTII,4.7,0,20.79,0.0,7,False,600
B01N8Q159X,"Dritz Craft & Household Use, 36"" x 6-Yards, Unbleached Cheesecloth, Beige",https://m.media-amazon.com/images/I/81bzdlUsHDL._AC_UL320_.jpg,https://www.amazon.com/dp/B01N8Q159X,4.6,0,7.05,0.0,7,False,200
B08Q7MK117,Random Faux Leather Sheets: Glitter Print Leather 20Pcs 8X12 Inch Grain Texture Embossed Colors Pattern Leather for Earrings Crafts,https://m.media-amazon.com/images/I/91eyym+38yL._AC_UL320_.jpg,https://www.amazon.com/dp/B08Q7MK117,4.3,0,13.99,16.99,7,False,200
B08YDP9Q67,"YYCRAFT Stiff Felt Sheets Thick Felt 9 Inch X 12 Inch - 15 Pcs Pack, White",https://m.media-amazon.com/images/I/61OQ-HmGLkL._AC_UL320_.jpg,https://www.amazon.com/dp/B08YDP9Q67,4.6,0,15.99,0.0,7,False,300
B095C3J3SJ,"Soft Waterproof Synthetic Fabric Material, Marine Vinyl Faux Leather Sheets,Durable,Replacement Renovate for Upholstery Muscle Car,Furniture, Sofa… (54inch x 30inch, Black)",https://m.media-amazon.com/images/I/513G9pyWBfL._AC_UL320_.jpg,https://www.amazon.com/dp/B095C3J3SJ,4.4,0,17.69,0.0,7,False,200
B099NFW353,15 Pieces Halloween Leather Sheet Glitter Synthetic Leather Sheet Autumn Faux Leather Sheet Plant Leather Fabric Sheet for DIY Crafts Decoration Supplies (Classic Style),https://m.media-amazon.com/images/I/91kXoFiKDUL._AC_UL320_.jpg,https://www.amazon.com/dp/B099NFW353,4.5,0,14.99,0.0,7,False,200
B01MCUFWAN,"60"" Poly Cotton Broadcloth Red, Fabric by the Yard",https://m.media-amazon.com/images/I/510QAlE4utL._AC_UL320_.jpg,https://www.amazon.com/dp/B01MCUFWAN,4.5,0,3.99,0.0,7,False,200
B000KNDMLG,"Liquitex BASICS Gesso Surface Prep Medium, 473ml (16-oz) Bottle, White",https://m.media-amazon.com/images/I/61-cQ+FdIrS._AC_UL320_.jpg,https://www.amazon.com/dp/B000KNDMLG,4.7,0,12.15,12.99,8,True,2000
B0BFWVR72D,"Simthread Embroidery Thread 5500 Yards Black 900, 40wt 100% Polyester for Brother, Babylock, Janome, Singer, Pfaff, Husqvarna, Bernina Machine",https://m.media-amazon.com/images/I/71aEJ0T4KbL._AC_UL320_.jpg,https://www.amazon.com/dp/B0BFWVR72D,4.6,0,7.99,0.0,8,True,1000
B076TT3TYN,Embroidery Floss Rainbow Color 50 Skeins Per Pack Cross Stitch Threads Friendship Bracelets Floss Crafts Floss,https://m.media-amazon.com/images/I/81Xa1u9TXwL._AC_UL320_.jpg,https://www.amazon.com/dp/B076TT3TYN,4.7,0,5.99,14.99,8,False,7000
B07YFBRZ3J,"Friendship Bracelet String 50 Skeins Rainbow Color Embroidery Floss Cross Stitch Embroidery Thread Cotton Floss Bracelet Yarn, Craft Floss",https://m.media-amazon.com/images/I/71HofdIB+uL._AC_UL320_.jpg,https://www.amazon.com/dp/B07YFBRZ3J,4.6,0,5.99,0.0,8,False,4000
B002PI751C,"SINGER 01125 Assorted Hand Needles - Betweens, Chenille, Darners, Embroidery, Sharps & Tapestry, Assorted Sizes, 45-Count",https://m.media-amazon.com/images/I/61KckFxj-3L._AC_UL320_.jpg,https://www.amazon.com/dp/B002PI751C,4.7,0,2.37,0.0,8,False,3000
B077Z5VJHN,New brothread 40 Brother Colors Polyester Embroidery Machine Thread Kit 500M (550Y) Each Spool for Brother Babylock Janome Singer Pfaff Husqvarna Bernina Embroidery and Sewing Machines,https://m.media-amazon.com/images/I/91PMz0R7XxL._AC_UL320_.jpg,https://www.amazon.com/dp/B077Z5VJHN,4.7,0,25.99,36.99,8,False,2000
B0747JY5Q2,Paxcoo 124 Skeins Embroidery Floss Cross Stitch Thread with Needles,https://m.media-amazon.com/images/I/61lazF8OahL._AC_UL320_.jpg,https://www.amazon.com/dp/B0747JY5Q2,4.7,0,9.99,15.99,8,False,2000
B07P5YDBZR,"Diamond Painting Storage Containers, Portable Bead Storage Organizer 64 Gird Diamond Painting Accessories (Storage Box)",https://m.media-amazon.com/images/I/71JO+Hl4MAL._AC_UL320_.jpg,https://www.amazon.com/dp/B07P5YDBZR,4.6,0,9.99,13.99,8,False,2000
B07HCGVVTM,Caydo 6 Pieces Embroidery Hoop Set Bamboo Circle Cross Stitch Hoop Ring 4 inch to 10 inch for Embroidery and Cross Stitch,https://m.media-amazon.com/images/I/61TTgAtY6mL._AC_UL320_.jpg,https://www.amazon.com/dp/B07HCGVVTM,4.6,0,6.99,18.0,8,False,1000
B0BXDFNQGT,"6 Pcs Embroidery Hoop 6 Size, Round Plastic Cross Stitch Hoop with 16 Needles (3.6In to 10.7 in), Small Embroidery Hoop, Cross Stitch Hoops and Frames, Suitable for Embroidery, Craft Sewing",https://m.media-amazon.com/images/I/71926d-CqWL._AC_UL320_.jpg,https://www.amazon.com/dp/B0BXDFNQGT,4.6,0,5.49,11.99,8,False,1000
B09QM2DRBV,EASTHILL Big Capacity Pencil Case Large Pencil Pouch Stationery Pen Bag for Teen Girls,https://m.media-amazon.com/images/I/71eIK969dUL._AC_UL320_.jpg,https://www.amazon.com/dp/B09QM2DRBV,4.7,0,11.99,15.99,9,True,10000
B088K3FQ7W,"Diamond Painting Storage Boxes, 60 Slots Bead Storage with 5D Diamond Art Accessories and Tools Kit",https://m.media-amazon.com/images/I/81p5G4NPQEL._AC_UL320_.jpg,https://www.amazon.com/dp/B088K3FQ7W,4.8,0,15.99,29.99,9,True,4000
B00FZVPWTI,"IRIS USA 10Pack Medium Plastic Storage Containers with Latching Lid for Pencil Box, Lego, Crayon",https://m.media-amazon.com/images/I/61BjqS8pPVL._AC_UL320_.jpg,https://www.amazon.com/dp/B00FZVPWTI,4.7,0,21.24,24.99,9,False,4000
B08P48YL4G,CICIMELON Large Capacity Pencil Case 3 Compartment Pouch Pen Bag for School Teen Girl Boy Men Women (Pink),https://m.media-amazon.com/images/I/811uUmKI8JL._AC_UL320_.jpg,https://www.amazon.com/dp/B08P48YL4G,4.7,0,9.99,10.99,9,False,3000
B09L82GT2R,"XQXA Big Capacity Pencil Case,Portable Handheld Pen Bag for Office Storage, Large Capacity Pencil Pouch for Men Women Adult (Black)",https://m.media-amazon.com/images/I/71sitTlFVhL._AC_UL320_.jpg,https://www.amazon.com/dp/B09L82GT2R,4.5,0,9.99,0.0,9,False,2000
B091KM2JDH,"FUXINGYAO Pencil Case, Multi- Slot Pencil Pouch, Portable Pencil Bag, Pen Case for& Office(Black)",https://m.media-amazon.com/images/I/61h8Sj8H6RL._AC_UL320_.jpg,https://www.amazon.com/dp/B091KM2JDH,4.5,0,8.99,9.99,9,False,6000
B0BYVCD47T,Plastic Organizer Box Craft Box Bead Organizer Tackle Box Organizer 2 Pack 15 Large Grids Clear Craft Storage Box Snackle Box Container Washi Tape Organizer,https://m.media-amazon.com/images/I/514oRCxfhTL._AC_UL320_.jpg,https://www.amazon.com/dp/B0BYVCD47T,4.5,0,8.48,16.97,9,False,1000
B09VTLZ9NC,"Small Bead Organizers, 15 Pieces Plastic Storage Cases Mini Clear Bead Storage Containers Transparent Boxes with Hinged Lid and Rectangle Clear Craft Supply Case",https://m.media-amazon.com/images/I/71KmdhTJf1L._AC_UL320_.jpg,https://www.amazon.com/dp/B09VTLZ9NC,4.7,0,7.99,9.99,9,False,2000
B08YBYBVX6,"12535 Stackable Craft Storage Box with Handle, Locking Art Supply , Plastic Containers with Lids, Craft Organizer , Frost",https://m.media-amazon.com/images/I/61F0OLZXkIL._AC_UL320_.jpg,https://www.amazon.com/dp/B08YBYBVX6,4.7,0,4.98,6.15,9,False,2000
B01H2NWHXU,"IRIS USA 6Pack 8.5"" x 11"" Portable Project Case Container with Snap-Tight Latch, Clear",https://m.media-amazon.com/images/I/71XaPP5bpZL._AC_UL320_.jpg,https://www.amazon.com/dp/B01H2NWHXU,4.6,0,33.99,39.99,9,False,2000
B00125KXGI,"Bostitch Personal Electric Pencil Sharpener - HHC Cutter Tech, Stall-Free Motor, High Capacity Tray, 7yr Warranty (EPS4-BLUE)",https://m.media-amazon.com/images/I/81BZjXwzBKL._AC_UL320_.jpg,https://www.amazon.com/dp/B00125KXGI,4.6,0,14.88,24.19,10,True,10000
B01N09ZDEI,"Soucolor 72-Color Colored Pencils for Adult Coloring Books, Soft Core, Artist Sketching Drawing Pencils Art Craft Supplies, Coloring Pencils Set Gift for Adults Kids Beginners",https://m.media-amazon.com/images/I/71Cd1bbIuYL._AC_UL320_.jpg,https://www.amazon.com/dp/B01N09ZDEI,4.7,0,9.99,0.0,10,True,10000
